,year,ein,object_id,taxpayer_name,compensation
5666,2018,930472403,201921979349300232,KNAPPA WATER ASSOCIATION,104663
4490,2018,452474481,201921969349301087,AC PORTLAND,186039
370,2018,930464898,201921929349301212,OREGON BAKERS UNION TRUST FUND,0
3610,2018,930880205,201921919349300957,GEOS INSTITUTE,548986
6918,2018,201887272,201921919349300747,TRYON LIFE COMMUNITY FARM,36588
4920,2018,943141614,201921919349300632,OREGON AGRICULTURAL EDUCATION FOUNDATION,16667
1796,2018,926004561,201921919349300242,INTERACT MINISTRIES INC,781976
2606,2018,931258154,201921909349301257,PACIFICA A GARDEN IN THE SISKIYOUS,193528
2000,2018,931290320,201921869349300617,PROUD GROUND,555441
652,2018,930410224,201921829349301192,BENEVOLENT AND PROTECTIVE ORDER OF ELKS 1862 HILLSBORO,124521
270,2018,911829325,201921829349301127,OREGON CLIMATE TRUST,1126379
4834,2018,911761885,201921759349300807,LAKE OSWEGO ROWING CLUB FOUNDATION,147830
5662,2018,474625986,201921719349300412,GRANT COUNTY YOUTH LIVESTOCK AUCTION,0
5582,2018,453558243,201921709349301402,PROVIDING OPPORTUNITY FOR SELF IMPROVEMENT CABARETE DOM REPUBLIC,0
1304,2018,930975605,201921709349300717,NORTHWEST NUTRITION SERVICE,297774
3770,2018,237211735,201921659349301227,UNITED STATES JUDO FEDERATION,232871
2376,2018,931146207,201921629349300127,COOS WATERSHED ASSOCIATION,615195
4120,2018,743052430,201921619349300627,OREGON CENTER FOR NURSING,292232
1842,2018,931244973,201921589349300217,CORVALLIS CARING PLACE,1032607
972,2018,930242330,201921579349300127,OREGON FARM BUREAU FEDERATION,1265693
5824,2018,260302137,201921569349300522,OREGON NATIVE AMERICAN CHAMBER,89459
1714,2018,930724422,201921559349300432,ASTORIA HIGH SCHOOL SCHOLARSHIPS INC,5818
7082,2018,931099580,201921549349300617,OREGON GRAND PRIX YOUTH BOWLING SCHOLARSHIP FOUNDATION,0
2824,2018,930682416,201921549349300022,CANDLELIGHTERS FOR CHILDREN WITH CANCER,291858
1494,2018,811902616,201921519349301202,BRIDES FOR A CAUSE,444744
2590,2018,930905013,201921509349301207,PARKINSONS RESOURCES OF OREGON,556197
2320,2018,453724787,201921509349300622,SHOREPINES BAY VILLAGE PROPERTIES INC,100094
5616,2018,911814094,201921439349300642,KNOW THYSELF AS SOUL FOUNDATION INTERNATIONAL,0
3674,2018,263757028,201921429349301857,CENTER FOR DIVERSITY AND THE ENVIRONMENT,157865
1070,2018,930339108,201921429349301772,ALUMNI ASSOCIATION OF THE UNIVERSITY OF OREGON INC,48250
312,2018,930634049,201921429349301462,MARYLHURST UNIVERSITY,8960410
5116,2018,930667629,201921429349300442,RIVERBEND PROPERTIES INC,0
7248,2018,943140269,201921419349301457,CENTER FOR PEACE WEST INC,0
4478,2018,237049918,201921419349301412,SAFE ASSOCIATION,46225
2192,2018,20706812,201921419349301232,THEDOVE MEDIA INC,762230
1732,2018,931031380,201921409349300977,SWEET HOME ECONOMIC DEVELOPMENT GROUP,208475
7254,2018,453261827,201921409349300637,HEALTH REPUBLIC INSURANCE COMPANY,160390
3182,2018,760774777,201921409349300227,CAMP TAPAWINGO INC,139806
1490,2018,930336168,201921409349300022,OREGON-COLUMBIA CHAPTER NECA,577369
3248,2018,364533809,201921379349300812,FAMILY AND COMMUNITY TOGETHER,637539
1638,2018,931310936,201921379349300322,TRILLIUM CHARTER SCHOOL,1668367
2188,2018,930236781,201921379349300232,INTERNATIONAL BROTHERHOOD OF TEAMSTERS UNION LOCAL NO 962,563303
1594,2018,510188664,201921379349300022,BRADLEY ANGLE,1420898
5368,2018,936030981,201921359349313987,AMERICAN LEGION - POST 56,50317
666,2018,237088811,201921359349313852,ON TRACK INC,6636487
5474,2018,930587874,201921359349313767,JOSEPHINE COUNTY SPORTSMAN ASSOC,78249
6150,2018,261931455,201921359349313522,WHITESIDE THEATRE FOUNDATION,0
5948,2018,930575887,201921359349313462,MADRAS-JEFFERSON COUNTY CHAMBER OF COMMERCE,114618
716,2018,930640525,201921359349313102,LIVING OPPORTUNITIES INC,6205992
916,2018,943038729,201921359349313047,REACH INC,2460377
1240,2018,930775757,201921359349312917,RAINBOW ADULT LIVING FACILITIES INC,2401714
2716,2018,930574297,201921359349312817,HEARTLAND HUMANE SOCIETY,637908
2362,2018,950934065,201921359349312717,BAY AREA ENTERPRISES INC,1226227
810,2018,936097406,201921359349312612,WILLAMETTE CARPENTER TRAINING CENTER INC,4243662
2978,2018,930989730,201921359349312567,FOUR RIVERS CULTURAL CENTER AND MUSEUM,308794
3564,2018,200092657,201921359349312557,THIRD RAIL REPERTORY THEATRE,249874
2706,2018,930117719,201921359349312447,BAKERY CONFECTIONERY TOBACCO WORKERS AND GRAIN MILLERS INTL UNION LOCAL 114,462375
4136,2018,582670951,201921359349311037,CIVIL LIBERTIES DEFENSE CENTER,213436
542,2018,930514209,201921359349310807,ST MARYS OF MEDFORD INC,5392793
3060,2018,264228349,201921359349310732,CALAPOOIA WATERSHED COUNCIL,270933
2164,2018,930606729,201921359349310562,CENTRO CULTURAL OF WASHINGTON COUNTY,954283
148,2018,930770054,201921359349310242,CASCADIA BEHAVIORAL HEALTHCARE,49570867
7190,2018,237098425,201921359349309997,FRANCIS CENTER,6610
996,2018,931119163,201921359349309752,JOYFUL NOISE CHILD DEVELOPMENT CENTERS INC,4228403
6284,2018,412094799,201921359349308397,CAPITAL MANOR FOUNDATION,0
7332,2018,930883707,201921359349307912,GREATER EUGENE INC CO CITY MANAGERS OFFICE,107777
788,2018,202985223,201921359349306297,NAZARENE HOSPITAL FOUNDATION,0
6506,2018,205919157,201921359349306127,DEEP DEMOCRACY INSTITUTE,37040
2690,2018,870690147,201921359349305932,ADVANTAGE SMILES FOR KIDS,1334
774,2018,208928388,201921359349305912,PROJECT ACCESS NOW,2260326
4456,2018,936030585,201921359349305902,AFSCME LOCAL 189,44448
6210,2018,454153036,201921359349305897,3D PDF CONSORTIUM INC,120600
7172,2018,270226308,201921359349305622,COLTON HELPING HANDS INC,0
6296,2018,930558267,201921359349305582,WALLOWA VALLEY GOLF ASSOCIATION,64320
4242,2018,943143417,201921359349305432,COALITION FOR KIDS INC,227752
1356,2018,201260228,201921359349302872,FIRST GROWTH CHILDREN AND FAMILY CHARITIES INC,443183
3410,2018,205164853,201921349349310642,OREGON STATE CAPITOL FOUNDATION,0
2378,2018,930952207,201921349349310117,NEW HOPE CHRISTIAN SCHOOLS,769617
3718,2018,510551932,201921349349310097,SMALL MIRACLES FOUNDATION,0
4858,2018,452770172,201921349349310062,TECH ALLIANCE OF CENTRAL OREGON,58325
6140,2018,510197068,201921349349309807,JACKSONVILLE CHAMBER OF COMMERCE,27353
5910,2018,200522710,201921349349309632,ALDER STREET LEARNING CENTER,176233
5120,2018,930986405,201921349349309527,CARITAS VILLA,0
378,2018,930591582,201921349349308827,TRANSITION PROJECTS INC,10215367
5298,2018,930718913,201921349349307967,CASCADES THEATRICAL COMPANY,85320
5008,2018,930852980,201921349349307807,PORTLAND METRO ARTS,145931
3752,2018,930255950,201921349349307002,BUILDING OWNERS AND MANAGERS ASSOCIATION OF OREGON,208436
240,2018,271790052,201921349349306582,SAINT ALPHONSUS MEDICAL CENTER BAKER CITY INC,17046311
6032,2018,320361565,201921349349306157,OREGON FALLEN BADGE FOUNDATION,0
2208,2018,264836268,201921349349305727,DIAL A BUS,1104166
5760,2018,205371832,201921349349304087,FOOD ROOTS,143305
1686,2018,451300894,201921349349303907,LE MONDE IMMERSION,1659272
5684,2018,205597705,201921349349303722,ALBINA OPPORTUNITIES CORPORATION DBA ASCENT FUNDING,256546
2016,2018,203435655,201921349349303537,COBURG COMMUNITY CHARTER SCHOOL,1612855
1232,2018,943111736,201921349349303262,COLUMBIA CASCADE HOUSING CORP,0
4894,2018,311399194,201921349349302722,CONGRESS OF CHIROPRACTIC STATE ASSOCIATION,65597
3900,2018,30456181,201921349349302347,COLUMBIA SLOUGH WATERSHED COUNCIL,351676
4152,2018,300792170,201921349349301437,CAREER TECH HIGH SCHOOL,0
64,2018,930386868,201921339349308357,MERCY MEDICAL CENTER INC,83634249
4222,2018,912080323,201921339349308172,NORTHWEST WOMENS INTERCOLLEGIATE BASKETBALL OFFICIALS ASSOCIATION,29609
264,2018,263946191,201921339349307947,CENTENNIAL MEDICAL GROUP INC,29899775
3042,2018,237438503,201921339349307802,WESTERN LANE COMMUNITY FOUNDATION,0
3768,2018,930892261,201921339349307727,COMMUNITY VOLUNTEER NETWORK,316380
5146,2018,311780332,201921339349307722,RVM PORTLAND HOUSING CORPORATION COLUMBIA TERRACE RETIREMENT COMMUNITY,114560
1806,2018,272767920,201921339349307662,COMMUNITY PATHWAYS INC,1168700
646,2018,930900577,201921339349307597,WORK UNLIMITED INC,8223262
2374,2018,463995696,201921339349307587,UNITED ACADEMICS OF THE UNIVERSITY OF OREGON,259346
5142,2018,300315618,201921339349307527,RVM CENTRAL POINT HOUSING CORPORATION CENTRAL POINT RETIREMENT COMMUNITY,114947
6254,2018,943136037,201921339349307487,RVM GRANTS PASS HOUSING CORPORATION FOOTHILL RETIREMENT CENTER,57360
5528,2018,43774565,201921339349307452,CEDAR SINAI PARK FOUNDATION,0
4414,2018,943247154,201921339349307432,RVM EUGENE HOUSING CORPORATION KINGSLEY COURT RETIREMENT CENTER,168975
3348,2018,272714653,201921339349307247,CLEARVIEW DISABILITY RESOURCE CENTER,244854
1784,2018,205865035,201921339349307237,NORTHWEST COMMUNITY CONNECTIONS INC DBA INDEPENDENCE NORTHWEST,1570317
4010,2018,930654269,201921339349306822,DISTRICT 6 MANPOWER PROGRAM INC,602954
672,2018,930825821,201921339349306797,OAKS PARK ASSOCIATION,3336542
2226,2018,611590160,201921339349306567,CAUSA OF OREGON,601482
956,2018,930777701,201921339349306262,ROGUE COMMUNITY COLLEGE FOUNDATION,0
2272,2018,510447137,201921339349306137,TRUSTED COMPUTING GROUP CO VITAL TECHNICAL MARKETING INC,0
1388,2018,464901375,201921339349305882,OCEAN OUTCOMES,888700
1236,2018,930467412,201921339349305372,GREENHILL HUMANE SOCIETY SPCA,1642671
1854,2018,930477279,201921339349304527,OREGON ASSOCIATION OF NURSERIES,822384
2912,2018,371582139,201921339349304287,NORTHEAST OREGON NETWORK,479628
372,2018,930398802,201921339349304172,MULTNOMAH UNIVERSITY,8190102
5678,2018,930977273,201921339349303847,KOREAN AMERICAN GROCERY ASSOCIATION,0
3996,2018,237131015,201921339349303317,KLAMATH HUMANE SOCIETY INC,268353
1134,2018,272865454,201921339349300437,GOOSE LAKE MEDICAL SERVICES INC,2170008
7278,2018,471286122,201921319349300637,SOUTHEAST COMMUNITY FOOD PANTRY AND CLOTHES CLOSET INC,0
1898,2018,20761530,201921319349300507,REGIONAL DISTRICT COUNCIL VACATION TRUST FUND,0
5018,2018,462377054,201921309349305327,COMMUNITY SUPPORTED SHELTERS,157412
2302,2018,931265144,201921309349305202,FLORENCE HABITAT FOR HUMANITY,150932
800,2018,930519925,201921309349305147,NECA-IBEW ELECTRICAL TRAINING CENTER,3291209
3518,2018,743261833,201921309349305092,HIGH DESERT PARTNERSHIP,357038
6534,2018,930890225,201921309349305037,MT HOOD SPECIAL HOUSING INC,0
170,2018,930468214,201921309349304882,RELAY RESOURCES,28663455
1610,2018,931203198,201921309349304362,VANCOUVER VILLAGE PROPERTIES INC CO MARK NORBY,0
3328,2018,811471087,201921309349304092,BUTTE CREEK MILL FOUNDATION,114985
4312,2018,311674605,201921309349304052,CATALYST FOUNDATION,73666
1568,2018,237052989,201921309349303922,TREASURE VALLEY COMMUNITY COLLEGE FOUNDATION,26928
6286,2018,476650627,201921309349303157,MACKENZIE ENGINEERING INC VEBA TRUST,0
254,2018,431960221,201921309349301757,SALEM HEALTH WEST VALLEY,15664816
3886,2018,930623407,201921309349301382,SHIELD OF FAITH MISSION INTERNATIONAL,18784
7296,2018,272948427,201921309349301042,FOUNDATION FOR EXPERIENTIAL LEARNING,0
5626,2018,273399695,201921299349302962,ALBERTA MAIN STREET,84958
6178,2018,931018566,201921299349302807,JACKSONVILLE WOODLANDS ASSOC INC,0
6836,2018,810646142,201921299349302717,SUNSET HOUSING INC,0
72,2018,930386892,201921299349302567,PACIFIC UNIVERSITY,79596337
78,2018,237083114,201921299349302537,OREGON HEALTH AND SCIENCE UNIVERSITY FOUNDATION,12782649
5054,2018,300999403,201921299349302327,OREGON TRUFFLE FESTIVAL,52539
5374,2018,455114020,201921299349300812,LLOYD ECODISTRICT,99820
3016,2018,930250590,201921299349300532,PENDLETON COUNTRY CLUB INC,347914
1266,2018,930111775,201921299349300327,AMALGAMATED TRANSIT UNION 757,1554830
3278,2018,770625836,201921299349300032,TERESA CHARITIES INC,84880
7252,2018,50601715,201921299349300022,FELLOWSHIP ASSOCIATION OF ST THERESE,0
4008,2018,931162218,201921289349301822,FOREST SERVICE EMPLOYEES FOR ENVIRONMENTAL ETHICS,325191
392,2018,930630376,201921289349301797,DELPHI SCHOOLS INC,6506805
2300,2018,931269503,201921289349301662,JACKSON STREET YOUTH SHELTER INC,1038879
5702,2018,931329815,201921289349300127,DOERNBECHER CHILDRENS HOSPITAL GROUP RETURN,0
3788,2018,930672605,201921279349301912,OREGON PEDIATRIC SOCIETY,344681
3516,2018,263664835,201921279349301127,PEACE IN SCHOOLS,449064
2430,2018,205085400,201921279349300142,WESTERN ANTIQUE AEROPLANE AND AUTOMOBILE MUSEUM,230120
7250,2018,930871543,201921269349301622,HOUSE OF ZION MINISTRIES INC,0
1156,2018,931074861,201921269349301592,FILM ACTION OREGON DBA HOLLYWOOD THEATRE,960901
7110,2018,930337087,201921269349301572,LENTS LODGE 156 ANCIENT FREE AND ACCE MASONS,8400
5594,2018,930901914,201921269349300782,TFP THERAPEUTIC SERVICES INC,198232
3756,2018,930803636,201921269349300547,NARAL PRO-CHOICE OREGON FOUNDATION,0
3708,2018,721536873,201921239349301732,UPPER NEHALEM WATERSHED COUNCIL,96930
698,2018,237115003,201921239349301587,SHELTERCARE,5299413
4118,2018,931075047,201921239349301447,NORTHWEST EARTH INSTITUTE,281619
7122,2018,510211528,201921229349301552,MT TABOR PRESBYTERIAN CHURCH FOUNDATION,0
1058,2018,931305252,201921229349300957,VISITOR DEVELOPMENT FUND INC,0
1152,2018,263967833,201921219349301247,PORTLAND HOMELESS FAMILY SOLUTIONS,1109736
3192,2018,931279550,201921209349301727,HEALING REINS THERAPEUTIC RIDING CENTER INC,418969
4444,2018,931180660,201921209349301137,SOUTHEAST SOCCER CLUB,0
1274,2018,936041247,201921209349301067,CENTRAL OREGON COMMUNITY COLLEGE FOUNDATION INC,414797
4586,2018,930607742,201921199349301367,CRATER LAKE ELECTRICAL JOINT APPRENTICESHIP AND TRAINING TRUST FUND,116457
2954,2018,237291187,201921199349301287,HOLLYWOOD SENIOR CENTER,375717
4740,2018,930766097,201921169349301407,SAFE OF COLUMBIA COUNTY,223747
762,2018,930504473,201921169349300532,PORTLAND JEWISH ACADEMY,5422597
1992,2018,930691187,201921139349301717,MCKENZIE RIVER GATHERING FOUNDATION,415956
3074,2018,930867552,201921139349300942,DONATE LIFE NORTHWEST,574884
4174,2018,451801715,201921129349301502,GROW OREGON,80000
1934,2018,911819749,201921129349300832,COLUMBIA PACIFIC FOOD BANK,161963
1622,2018,931111344,201921129349300617,NORTHWEST CHILDRENS THEATER AND SCHOOL INC,1112055
1326,2018,912072298,201921129349300447,NON-PROFIT TECHNOLOGY ENTERPRISE NETWORK,1147243
1360,2018,943144895,201921099349300622,ROSE COMMUNITY DEVELOPMENT CORPORATION,545097
712,2018,930784775,201921069349300102,GLEANERS OF CLACKAMAS COUNTY INC,0
4572,2018,366142488,201921059349300627,ALFA ROMEO OWNERS CLUB,0
5446,2018,930427037,201921039349300517,PORTLAND GARDEN CLUB,60413
6570,2018,930896252,201921029349301032,DOWNTOWN CORVALLIS ASSOCIATION INC,114888
3114,2018,931065518,201921029349300647,KIDSPIRE,388308
2610,2018,331098775,201921029349300427,NIXYAWII COMMUNITY SCHOOL,682587
1646,2018,911015971,201921019349300977,PUBLIC POWER COUNCIL,1487122
7194,2018,936031760,201921009349300822,HOOD RIVER SADDLE CLUB,9302
1872,2018,930954555,201920999349300622,MONTESSORI SCHOOL OF BEAVERTON LTD,1269655
3634,2018,263675794,201920999349300302,NORTHWEST PBIS NETWORK INC,431189
566,2018,237030910,201920969349300612,SOUTHERN OREGON UNIVERSITY FOUNDATION,0
6516,2018,452155198,201920959349301257,NORTH LAKE EDUCATION FOUNDATION INC,0
530,2018,930706892,201920949349300227,DE PAUL TREATMENT CENTERS INC,7901690
6974,2018,463534442,201920929349300867,COMUNIDAD VIVA,0
4230,2018,930292610,201920899349300117,SUPERCARGOES AND CLERKS UNION,222426
776,2018,930397825,201920879349300932,METROPOLITAN FAMILY SERVICE,5547026
3266,2018,800360134,201920879349300612,ETHNOGRAPHIC PRAXIS IN INDUSTRY CONFERENCE,0
3458,2018,931311608,201920879349300522,JOHNSON CREEK WATERSHED COUNCIL BLVD,276495
6892,2018,861002283,201920869349301017,IRISH SETTER CLUB OF AMERICA FOUNDATION INC CO JAY ZIRKLE TREASURER,0
2260,2018,930665804,201920859349301007,DOMESTIC VIOLENCE RESOURCE CENTER INC,1039345
5620,2018,930589287,201920859349300617,FRATERNAL ORDER OF EAGLES 3284,91153
826,2018,930758732,201920859349300347,YAMHILL COMMUNITY ACTION PARTNERSHIP,1747100
2902,2018,821749087,201920849349300617,FRIENDS OF THE CHILDREN CENTRAL OREGON,293615
224,2018,931329158,201920819349301502,MOSAIC MEDICAL,23283960
2112,2018,203372393,201920819349301042,PHOENIX SCHOOL OF ROSEBURG CHARTER,839336
6238,2018,931244225,201920819349301002,CENTRAL OREGON PUBLIC SAFETY CHAPLAINCY,224047
534,2018,931269087,201920819349300432,BESTCARE TREATMENT SERVICES INC,8883485
3344,2018,931081742,201920799349300412,IATSE LOCAL 488 STUDIO MECHANICS,355518
6044,2018,452252926,201920799349300332,FOUNDATIONS FOR RECOVERY,111142
6390,2018,931277874,201920749349301572,BROOKINGS HARBOR CHRISTIAN SCHOOL,134585
1196,2018,930671722,201920739349301227,RIVERSIDE TRAINING CENTERS INC,2634313
5670,2018,941581549,201920739349300702,ASSOCIATION OF PACIFIC PORTS,0
1032,2018,936018523,201920729349301117,SALEM FOUNDATION,327815
6958,2018,930692078,201920729349300617,HOPE AND WHOLENESS COUNSELING,33259
4146,2018,237023370,201920709349301162,RIVERDALE PARENT TEACHER CLUB,0
2138,2018,931025497,201920709349301122,HABITAT FOR HUMANITY OF THE MID-WILLAMETTE VALLEY,600065
1856,2018,263161884,201920709349301017,COLLEGE DREAMS INC,979221
6440,2018,930861079,201920689349300507,INDIAN MEADOW WATER COMPANY,38570
6412,2018,930194935,201920689349300002,IDLEWILDE FRATERNAL CEMETERY ASSOC,58493
1046,2018,931278089,201920669349301357,PORTLAND CHILDRENS MUSEUM,3166172
908,2018,931249298,201920649349301152,LOWER COLUMBIA ESTUARY PARTNERSHIP,1869257
1968,2018,943215621,201920649349300822,CASA OF JACKSON COUNTY INC,718681
7240,2018,465673059,201920639349301362,HERMISTON ROTARY CLUB FOUNDATION,0
2068,2018,237006873,201920639349301207,OREGON REHABILITATION ASSOCIATION,585114
6582,2018,432057140,201920639349300887,CRESCENT ISLAMIC MONTESSORI SCHOOL,77229
5452,2018,930913394,201920619349300317,MID-VALLEY GARBAGE AND RECYCLING ASSOC,0
2054,2018,931264938,201920609349301202,OREGON MASONIC CHARITABLE FOUNDATION INC,0
6116,2018,472354839,201920599349300912,HISTORIC HILLSBORO DOWNTOWN PARTNERSHIP,59017
3472,2018,931308023,201920579349300967,TODOS JUNTOS INC,578189
7266,2018,936032331,201920579349300702,COOS BAY STUDENT LOAN FUND,3268
796,2018,930661527,201920569349300022,RON WILSON CENTER FOR EFFECTIVE LIVING,5765035
7198,2018,930884562,201920529349301312,SICKLE CELL ANEMIA FOUNDATION OF OREGON INC,12230
1132,2018,930684495,201920529349301122,PUBLIC DEFENDER SERVICES OF LANE COUNTY INC,3169719
6642,2018,930515824,201920529349300422,WASHINGTON COUNTY FARM BUREAU,0
4064,2018,463691938,201920529349300237,GLOBAL MISSIONS INTERNATIONAL INC,30000
2514,2018,931029893,201920519349301227,HEAT OREGON,338786
5576,2018,930578424,201920519349300122,OREGON SEED ASSOCIATION,0
898,2018,930589987,201920509349301212,SALEM CHILD DEVELOPMENT CENTER,4108494
6240,2018,930790867,201920489349300202,CLACKAMAS COUNTY 4-H ASSOCIATION INC,0
2056,2018,930773410,201920469349302452,MERIDIAN PARK MEDICAL FOUNDATION,0
32,2018,930386793,201920469349302327,LEGACY GOOD SAMARITAN HOSPITAL AND MEDICAL CENTER,157145297
390,2018,930848530,201920469349302267,LEGACY VISITING NURSE ASSOCIATION,12347869
464,2018,930582004,201920469349301287,GARTEN SERVICES INC,9876701
3638,2018,930736403,201920469349300722,SUNRIVER MUSIC FESTIVAL,125424
3862,2018,931208405,201920459349302022,CHESS FOR SUCCESS,300050
4496,2018,943194403,201920449349301632,GRANTS PASS HIGH SCHOOL BOOSTER CLUB,0
1990,2018,930556378,201920449349300437,AMERICAN CIVIL LIBERTIES UNION OF OREGON INC,141291
290,2018,526038494,201920449349300127,SHEET METAL AIR RAIL AND TRANSPORTATION LOCAL 100 HEALTH BENEFIT PLAN,0
3080,2018,930572034,201920439349301327,MARIST HIGH SCHOOL FOUNDATION,0
5328,2018,930686098,201920439349300332,EASTERN OREGON REGIONAL ARTS COUNCIL,90051
3910,2018,203530960,201920429349301217,FINANCIAL BEGINNINGS,357516
6876,2018,936034947,201920399349301402,MULTNOMAH CHANNEL YACHT CLUB,0
4950,2018,936024969,201920399349301317,CHI OMEGA BUILDING ASSOCIATION,45149
2754,2018,931069211,201920399349301032,CAPITAL FUTBOL CLUB,447254
6904,2018,237014569,201920389349301277,HOLLYWOOD ROSE CITY LITTLE LEAGUE,0
2286,2018,930864239,201920379349300627,MCKENZIE PERSONNEL SYSTEMS,1018477
4648,2018,450519586,201920369349301317,ARTS ACTION ALLIANCE FOUNDATION,287439
4902,2018,930581138,201920369349301227,GLIDE WATER ASSOCIATION,156722
3532,2018,470898679,201920369349300647,WILLAMETTE VALLEY VISITORS ASSOC,0
3156,2018,930853414,201920359349301257,ST IGNATIUS SCHOOL FOUNDATION,0
3242,2018,931281568,201920359349300992,COALITION OF GRADUATE EMPLOYEES AFT LOCAL 6069,98168
1580,2018,930514708,201920359349300967,OREGON RESTAURANT AND LODGING ASSOCIATION,861936
5352,2018,943192760,201920319349301307,COSA INC CENTRAL OREGON SYMPHONY ASSOCIATION,60315
748,2018,930575647,201920319349300612,COMMUNITY CONNECTION OF NE OREGON INC,3027037
3600,2018,931150366,201920309349300737,OREGON WRESTLING ASSOCIATIONINC,0
2970,2018,931062727,201920299349301272,SOUTHERN OREGON REGIONAL ECONOMIC DEVELOPMENT INC,509359
1522,2018,931117289,201920299349300947,OREGON STATE ELKS ASSOCIATION TRUST,0
5876,2018,930520440,201920299349300327,ASSOCIATION OF WESTERN PULP AND PAPER WORKERS LOCAL 677,86395
820,2018,930686681,201920299349300112,CHILD CARE DEVELOPMENT SERVICES INC,563708
582,2018,237170147,201920289349300772,AGC HEALTH BENEFIT TRUST FUND,0
5422,2018,930845104,201920289349300632,PIONEER HUMANE SOCIETY,101896
2132,2018,593824209,201920289349300327,CASCADE HEIGHTS PUBLIC CHARTER SCHOOL,1031892
1322,2018,930924815,201920269349300307,UP AND OUT INC,2265393
618,2018,930576732,201920259349301352,OPPORTUNITY FOUNDATION OF CENTRAL O,8229691
5140,2018,264827713,201920239349300717,CANONSBURG CORPORATION OREGON PHI KAPPA PSI ASSOCIATION,31228
4160,2018,261932352,201920239349300017,TREASURE VALLEY CHILDRENS RELIEF NURSERY,333689
6282,2018,930299877,201920209349300402,FRATERNAL ORDER OF EAGLES 2196 AERIE,59664
1440,2018,936041506,201920189349301032,OREGON LIONS SIGHT AND HEARING FOUNDATION,1065634
1226,2018,930462679,201920179349300642,OREGON SOCIETY OF CERTIFIED PUBLIC ACCOUNTANTS,1004338
1708,2018,930775354,201920169349300547,MALHEUR COUNTY CHILD DEVELOPMENT CENTER,1727677
3828,2018,930881300,201920159349301072,ALBANY PUBLIC SCHOOLS FOUNDATION,87156
4194,2018,300340412,201920159349300717,TUALATIN VALLEY GLEANERS,0
5526,2018,930570653,201920159349300427,AFGE LOCAL 2157,0
1772,2018,930820623,201920149349300977,UMPQUA VALLEY PUBLIC DEFENDER,1828819
6550,2018,931327751,201920119349300617,YAMHILL COUNTY AFFORDABLE HOUSING CORPORATION,0
6658,2018,931329744,201920109349301962,EAST PORTLAND SUPPORTIVE HOUSING INC,38155
6666,2018,931199803,201920109349301872,HILLSBORO SUPPORTIVE HOUSING INC,24397
3134,2018,931180321,201920109349301402,HABITAT FOR HUMANITY OF OREGON INC,210968
5912,2018,930592392,201920109349300502,BANDON CHAMBER OF COMMERCE,56982
3218,2018,743067545,201920109349300327,SHERIDAN JAPANESE SCHOOL FOUNDATION,532756
3892,2018,371778239,201920109349300307,SPRING MOUNTAIN CHRISTIAN,342118
6038,2018,930926682,201920099349300917,OREGON COALITION OF LOCAL HEALTH OFFICIALS INC,189181
2956,2018,931120631,201920099349300517,DISTRIBUTED MANAGEMENT TASK FORCE INC,0
5816,2018,936026158,201920099349300442,SIGMA CHI BUILDING ASSOCIATION,0
3578,2018,930802694,201920089349301532,SIGMA ALPHA EPSILON FRATERNITY OREGON BETA CHAPTER,44482
7340,2018,931262611,201920089349301342,TREASURE VALLEY PARAMEDICS FOUNDATI PATTERSON,0
3628,2018,930823216,201920089349301237,TILLAMOOK COUNTY WOMENS RESOURCE CENTER,412048
7048,2018,455045072,201912209349300841,OREGON LOGGING CONFERENCE FOUNDATION,0
1256,2018,930599922,201912209349300736,BENEVOLENT AND PROTECTIVE ORDER OF THE ELKS LODGE NO 2472,163011
6448,2018,205994627,201912209349300631,CLACKAMAS COUNTY PEACE OFFICERS BENEVOLENT FOUNDATION,0
6916,2018,320053298,201912199349301101,AFFORDABLE HOUSING SOLUTIONS,0
3660,2018,931226663,201912199349300306,BIRTHINGWAY COLLEGE OF MIDWIFERY,548612
1612,2018,200773189,201912139349301081,CAT ADOPTION TEAM,1356441
2228,2018,20584357,201912129349301366,TILLAMOOK ESTUARIES PARTNERSHIP,517403
2058,2018,930823952,201912129349300726,ABILITREE,1217975
94,2018,930453216,201912119349301601,ROGUE VALLEY MANOR,24742721
432,2018,930557803,201912119349301366,CASCADE MANOR INC,4907080
1512,2018,931330100,201912119349301281,CASCADE MANOR FOUNDATION INC,0
2938,2018,352304457,201912119349300706,OREGON DOG RESCUE,289600
5554,2018,300745582,201912109349301556,DIVIDE CAMP INC,5203
1390,2018,930151383,201912109349301306,DAIRY BAKERY AND FOOD PROCESSORS INDUST TECH AND AUTOMOTIVE LOCAL UNION NO 305,1547634
1228,2018,205090246,201912109349300646,GREEN ELECTRONICS COUNCIL,1811033
3992,2018,931025665,201912109349300546,PREGNANCY CARE CENTER OF GRANTS PASS,406386
7276,2018,263438492,201912069349301306,ROGUE RIVER VALLEY UNIVERSITY CLUB SCHOLARSHIP FOUNDATION,0
6564,2018,930267435,201912069349301166,ROGUE RIVER VALLEY UNIVERSITY CLUB,66635
4234,2018,320000467,201912069349300721,WILLAMETTE VALLEY CANCER FOUNDATION,0
1324,2018,931162366,201912039349301851,DEATH WITH DIGNITY NATIONAL CENTER,392468
4940,2018,200165409,201912039349301486,GREATER PORTLAND SOCCER DISTRICT,9416
4606,2018,931294227,201912039349301421,BEYOND TOXICS,283265
4286,2018,931322729,201912039349301396,CANBY KIWANIS FOUNDATION INC,236099
5596,2018,262566500,201912039349301236,INTERNATIONAL CARPE DIEM FOUNDATION,93306
3154,2018,237450926,201912039349301216,COLUMBIA RIVER STEAMSHIP OPERATORS ASSOCIATION INC,316867
3888,2018,930796407,201912039349300276,PRINEVILLE HOSPITAL FOUNDATION,0
518,2018,263035522,201911989349301256,LIONS VISIONGIFT,4537645
5102,2018,931309045,201911969349301861,SALEM SATURDAY MARKET,131182
2658,2018,237220421,201911969349301401,TUALATIN HILLS SWIM CLUB,418661
2630,2018,931057956,201911969349301346,STREET TRUST,673763
3684,2018,943036846,201911959349300606,HANDICAP AWARENESS AND SUPPORT LEAGUE,424832
2672,2018,451778609,201911939349301751,WILD LILAC CHILD DEVELOPMENT COMMUNITY,748547
172,2018,200195556,201911939349301706,OCHIN INC,31694866
