,year,ein,object_id,taxpayer_name,compensation
2470,2018,931078791,201900389349300325,WEST TUALITY HABITAT FOR HUMANITY,398063
5324,2018,352533894,201900389349300320,SEIU LOC 503 OREGON PUBLIC EMPLOYEES UNION GROUP RETURN,0
1008,2018,931110874,201900379349300965,CENTER FOR CONTINUOUS IMPROVEMENT,3956723
2346,2018,204643206,201900379349300630,HOPEXCHANGE INC,0
5492,2018,930909586,201900369349301315,UMPQUA ACTORS COMMUNITY THEATRE,39179
3804,2018,936031045,201900369349301115,DOUGLAS RIDGE RIFLE CLUB,4678
1734,2018,931318954,201900369349300425,KINGS VALLEY CHARTER SCHOOL,121745
2732,2018,471863402,201900359349301270,VALLEY SCHOOL OF,345572
2576,2018,201688621,201900359349301165,BAKER COUNTY DEVELOPMENT CORPORATION,148035
7322,2018,822111662,201900349349300400,COY MANOR,0
1394,2018,930782467,201900329349301035,FRIENDS OF THE COLUMBIA GORGE,1085744
6372,2018,931017646,201900329349300935,MT BACHELOR ROTARY CLUB,0
1186,2018,562563880,201900329349300745,FRIENDS OF THE COLUMBIA GORGE LAND TRUST,346502
3714,2018,931084099,201900319349300425,ASSC OF OREGON CORRECTIONS EMPLOYEES,91066
1418,2018,930517401,201900319349300420,CORNERSTONE ASSOCIATES INC,2137117
3036,2018,930509173,201900309349300300,CANTERBURY CREST INC,159695
7298,2018,931270010,201900309349300140,DAVID R KINGSLEY FOUNDATION,0
506,2018,931180397,201900299349301310,WILLAMETTE FAMILY MEDICAL CENTER INC,6076667
4534,2018,463458457,201900289349300820,SOUTH COAST FAMILY HARBOR,254976
2400,2018,930792125,201900289349300040,CENTER AGAINST RAPE AND DOMESTIC VIOLENCE,933309
2494,2018,930115760,201900269349300510,ASTORIA-WARRENTON CHAMBER OF COMMERCE,392397
3366,2018,421598432,201900259349300615,ACADEMIA DE LES LLETRES I BELLES AR,304602
4646,2018,936049712,201900259349300520,HEAT AND FROST INSULATOR AND ASBESTOS WORKER APPRENT AND JRNYMAN TRAINING,189217
6548,2018,237174336,201900259349300015,FOUNDATION OF THE ROTARY CLUB OF EAST PORTLAND,0
38,2018,911148123,201900249349301105,MERCY CORPS,109496227
2660,2018,930582360,201900249349301030,ASSOCIATION OF OREGON COMMUNITY MENTAL HEALTH PROGRAMS,552733
6764,2018,237098433,201900219349300225,SALEM AUDUBON SOCIETY,18758
2310,2018,931327847,201900189349301215,VOLUNTEERS IN MEDICINE CLINIC OF THE CASCADES,680295
3908,2018,930381128,201900189349301140,OREGON CATTLEMENS ASSOCATION,197640
4078,2018,936031819,201900189349301035,OREGON SYMPHONY ASSOCIATION IN SALEM,120906
850,2018,930556589,201900189349300025,STAR OF HOPE ACTIVITY CENTER INC,5155644
686,2018,930394142,201900179349300870,UNITED WAY OF LANE COUNTY,1708266
2906,2018,930638731,201900179349300635,CENTRO LATINO AMERICANO,611131
4588,2018,931279933,201900179349300020,SYSTEM IO INC DBA INFINIBAND TRADE ASSOCIATION,0
7024,2018,453737474,201900169349300725,BEAVERTON DOWNTOWN ASSOCIATION INC,45994
2492,2018,930195535,201900169349300200,INDEPENDENT ORDER OF ODD FELLOWS,193291
3712,2018,930280615,201900159349301355,SIGMA ALPHA EPSILON FRATERNITY OREGON ALPHA CHAPTER,16566
2476,2018,930170027,201900159349301100,FRATERNAL ORDER OF EAGLES AERIE 2093,30230
3856,2018,930480213,201900159349300850,CAMP FIRE WILANI,110604
6318,2018,931033067,201900159349300300,PACER CLUB INC,0
4818,2018,201103586,201900159349300245,SHINING STAR SCHOOL INC,219636
3310,2018,201024637,201900149349300970,YOUNG ENTREPRENEURS BUSINESS PROGRAMS,273534
5134,2018,930842933,201900149349300545,COLUMBIA ACADEMY,201791
4320,2018,930223400,201900119349300030,MCMINNVILLE AREA CHAMBER OF COMMERCE,202023
2508,2018,931168181,201900109349301215,FERAL CAT COALITION OF OREGON,489176
5938,2018,10755594,201900109349301125,SCHOOL GARDEN PROJECT OF LANE COUNTY,202163
4100,2018,931284335,201900109349300145,FAMILIAS EN ACCION,346687
3478,2018,930794078,201900099349300710,MT HOOD SWIM TEAM,299118
1264,2018,930840810,201900089349302235,TUALITY PROPERTY MANAGEMENT,0
708,2018,930561977,201900089349302180,UNITED ASSOCIATION LOCAL 290 APPRENTICE AND JOURNEYMEN TRAINING TRUST,3747952
852,2018,455252325,201843559349300539,CURRY COMMUNITY HEALTH,4294238
5664,2018,930787310,201843529349300444,ADAPTIVE SPORTS NORTHWEST,136528
6278,2018,912032896,201843519349301154,INNER JOURNEY HEALING ARTS CENTER,117792
2796,2018,911757262,201843519349300934,UPPER DESCHUTES WATERSHED COUNCIL,367744
1292,2018,930833241,201843519349300604,DOUGY CENTER INC,1078154
726,2018,931278639,201843519349300324,MASTERY LEARNING INSTITUTE,5612068
1624,2018,930472773,201843489349301159,EMERALD KIDSPORTS,763310
3070,2018,263036492,201843479349301209,NORTHWEST CHINESE ACADEMY,534038
5024,2018,300390131,201843479349300024,FRIENDS OF FAMILY FARMERS,142341
1320,2018,930943494,201843459349300544,FRIENDS OF CANBY ADULT CENTER INC,424594
892,2018,930584827,201843409349300904,PEARL BUCK CENTER INCORPORATED,4572038
1374,2018,930594367,201843389349300019,MARIE MILLS CENTER INC,2498241
1060,2018,912077840,201843379349300404,VIRGINIA GARCIA MEMORIAL FOUNDATION,0
158,2018,930717997,201843379349300384,VIRGINIA GARCIA MEMORIAL HEALTH CENTER,41822859
1158,2018,931192100,201843339349301019,ASIAN HEALTH AND SERVICE CENTER INC,2237071
5782,2018,930955040,201843329349300714,MCN INTERNATIONAL INC,55429
6430,2018,930921983,201843309349300239,LA PINE SENIOR CITIZENS INC,33610
4958,2018,320414056,201843259349300224,NORTHEAST OREGON WATER ASSOCIATION CO JR COOK,171997
628,2018,930763726,201843259349300219,OEA CHOICE TRUST,890732
6264,2018,770592635,201843249349301104,TILLAMOOK SCHOOL DISTRICT NO 9 FOUNDATION,0
6816,2018,931106516,201843249349301059,MOLALLA RIVER EDUCATION FOUNDATION MOLALLA RIVER SCHOOL DIST FOUND,0
6656,2018,931037644,201843249349301004,CANBY ROTARY FOUNDATION INC,0
4040,2018,931204730,201843239349301004,ALSEA COMMUNITY EFFORT,0
1766,2018,930604321,201843209349301004,PACIFIC NORTHWEST OUTREACH INC,298340
1744,2018,931060919,201843199349320104,OPEN ARMS INTERNATIONAL,468973
4854,2018,931089891,201843199349318894,OREGON BREWERS GUILD,110671
384,2018,731668317,201843199349318509,PARADIGM INDEMNITY CORPORATION,0
122,2018,931329784,201843199349318469,SAMARITAN PACIFIC HEALTH SERVICES,52396469
5484,2018,930994040,201843199349318349,OREGON WOMEN LAWYERS,107430
3882,2018,930749992,201843199349318329,UPWARD BOUND CAMP FOR PERSONS WITH SPECIAL NEEDS INC,234145
6806,2018,61706401,201843199349318259,GREATER PORTLAND ECONOMIC DEVELOPMENT DISTRICT,99374
3676,2018,930758252,201843199349317974,WILLAMETTE WRITERS INC,0
448,2018,273524752,201843199349317399,NEIGHBORHOOD HEALTH CENTER,9997315
4568,2018,237097546,201843199349317324,MOTHER AND CHILD EDUCATION CENTER,131727
1260,2018,930724691,201843199349317054,SOUTHERN OREGON LAND CONSERVANCY INC,387246
4782,2018,931030730,201843199349316929,OASIS SHELTER HOME INC,238462
1088,2018,930716519,201843199349316844,DOUGLAS RESIDENT TRAINING FACILITIES INC,3357558
4090,2018,264523843,201843199349316314,OREGON CRIME VICTIMS LAW CENTER,441786
4526,2018,936030371,201843199349315974,LINCOLN COUNTY FOUNDATION,0
4922,2018,452851834,201843199349315544,PROJECT BLOOM,0
1102,2018,383816505,201843199349314774,COASTAL HOME HEALTH AND HOSPICE,1705219
7176,2018,943098301,201843199349313304,OREGON TRAIL PRESERVATION TRUST INC,0
2586,2018,271344277,201843199349311919,ARTULA INSTITUTE FOR ART AND ENVIRONMENTAL ED,371245
3964,2018,936031765,201843199349310764,INTL ALLIANCE OF THEATRICAL STAGE EMPLOYEES UNION LOCAL 28,267805
2472,2018,931261999,201843199349309984,ROGUE RETREAT,426583
894,2018,931097066,201843199349309664,STANDARD INSURANCE COMPANY CONTINUING HEALTH AND WELFARE BENEFIT TRUST,0
5420,2018,202582034,201843199349309514,OREGON CANCER FOUNDATION,87913
846,2018,931296452,201843199349309109,USB IMPLEMENTERS FORUM INC CO VTM GROUP,0
4338,2018,464296454,201843199349308669,CAMP UKANDU,151803
440,2018,930800140,201843199349308439,PROVIDENCE CHILD CENTER FOUNDATION,188262
6120,2018,272202107,201843199349308069,BAKER CITY BRONC AND BULL RIDING,0
508,2018,930893420,201843199349307839,UNITED FOOD AND COMMERICAL WORKERS LOCAL 555,6525245
6074,2018,454754699,201843199349307804,STAGE RIGHT PRODUCTIONS,23258
3302,2018,203549992,201843199349307729,SALEM FREE CLINICS,271532
5436,2018,931289263,201843199349307554,PORTLAND AFFORDABLE HOUSING PRESERVATION TRUST,0
5490,2018,680481140,201843199349307549,CALIFORNIA CHAPTER OF THE FOUNDATION FOR NORTH AMERICAN WILD SHEEP,0
324,2018,930433696,201843199349307524,NORTHWEST CHRISTIAN UNIVERSITY,8509430
5884,2018,271899059,201843199349307259,SALEM POLICE FOUNDATION,0
5600,2018,820539434,201843199349307089,SMITH RIVER WATERSHED COUNCIL,57965
7080,2018,936033218,201843199349306934,SALMON FOR ALL INC,17481
3336,2018,930561262,201843199349306844,OREGON CONCRETE AND AGGREGATE PRODUCERS ASSOCIATION INC,324885
1914,2018,931259522,201843199349306569,OREGON PUBLIC HEALTH INSTITUTE,658961
1552,2018,412065177,201843199349306414,WORLD PULSE VOICES,1127132
7326,2018,203871673,201843199349304829,BLANCHET CATHOLIC SCHOOL PROPERTY FOUNDATION,0
4432,2018,237033569,201843199349304064,ROGUE VALLEY ASSOCIATION OF REALTORS INC,0
3254,2018,930639711,201843199349303784,MUSEUM AT WARM SPRINGS,417115
5192,2018,260694904,201843189349313679,CORVALLIS HOMELESS SHELTER COALITION,138579
5860,2018,461482848,201843189349313404,INSPIRE FOUNDATION INC,86100
4926,2018,205502851,201843189349313234,COMMUNITY FOUNDATION OF THE KLAMATH BASI,34166
562,2018,931230223,201843189349313029,KLAMATH HEALTH PARTNERSHIP INC,7657120
704,2018,822399486,201843189349312969,JOHN AND GINGER NIEMEYER FOUNDATION,0
822,2018,930793127,201843189349312889,SEQUOIA MENTAL HEALTH SERVICES INC,4219111
2848,2018,931267455,201843189349312714,ISAACS ROOM,158058
2972,2018,930734928,201843189349312604,LA WATER CO-OPERATIVE,201081
5426,2018,931223422,201843189349312394,SISTERS SCHOOLS FOUNDATION INC,0
3252,2018,200758858,201843189349312289,YAMHILL COUNTY GOSPEL RESCUE MISSION,328325
1484,2018,943101853,201843189349312274,HOMEWOOD CORPORATION DBA HOMEWOODS ON THE WILLAMETTE,875580
4608,2018,931014651,201843189349312264,MULTNOMAH ATHLETIC FOUNDATION,95005
4032,2018,820727416,201843189349311979,OREGON FUTBOL ACADEMY,103455
5998,2018,930889147,201843189349311889,MAYDAY INC,117074
5222,2018,931277816,201843189349311834,PHOTO AMERICAS,105990
3350,2018,930159225,201843189349310879,EASTERN LANE FOREST PROTECTIVE ASSOC,0
162,2018,930591240,201843189349310454,OREGON CHILD DEVELOPMENT COALITION,40946929
5712,2018,931309774,201843189349310039,PORTLAND STATE UNIVERSITY ALUMNI AS,0
2750,2018,931329820,201843189349309684,GLOBAL CHRISTIAN COMMUNICATIONS INC,6000
4420,2018,931241304,201843189349308884,OREGON TECHNOLOGY BUSINESS CENTER,163566
4842,2018,930790443,201843189349308324,SAFE PROJECT,296493
2332,2018,237088799,201843189349308234,SANDY COMMUNITY ACTION COUNCIL INC,70436
5364,2018,911780361,201843189349305329,SALEM MULTICULTURAL INSTITUTE,122173
3584,2018,462515495,201843189349305174,ALLIES IN CHANGE,468770
3742,2018,931283456,201843189349305094,PHOENIX COUNSELING CENTER INC,429564
4728,2018,930733174,201843189349304489,FRIENDS OF OLD FORT STEVENS,50183
1376,2018,930685729,201843189349304464,SOUTH COAST BUSINESS EMPLOYMENT CORPORATION,1391869
6458,2018,931136024,201843189349303979,ILLINOIS VALLEY FAMILY COALITION,76612
1122,2018,201056268,201843189349301914,COLUMBIA RIVER COMMUNITY HEALTH SERVICES,2556252
1672,2018,931003750,201843189349300704,PROVIDENCE WILLAMETTE FALLS MEDICAL FOUNDATION,114162
1162,2018,930577975,201843179349308419,WILLAMETTE HUMANE SOCIETY,1921285
454,2018,930621534,201843179349308414,DOVELEWIS EMERGENCY ANIMAL HOSPITAL INC,10040766
3654,2018,930388543,201843179349308399,PHI CHAPTER OF ALPHA GAMMA DELTA,0
586,2018,930554950,201843179349308369,OREGON ASSOCIATION OF HOSPITALS AND HEALTH SYSTEMS,2958215
2334,2018,911787129,201843179349308189,CHRISTIANS AS FAMILY ADVOCATES,320989
5732,2018,936030683,201843179349308164,EUGENE YACHT CLUB,52946
608,2018,931133639,201843179349307979,CASCADE HOUSING ASSOCIATION,453212
1432,2018,931014222,201843179349307884,CRABTREE AND RAHMSDORFF DEFENSE SERVICES INC,2405620
6784,2018,931285490,201843179349307384,GRANTS PASS HIGH SCHOOL BAND BOOSTERS,0
3354,2018,811338641,201843179349307194,EVOLVE WORK FORCE AND MULTIFAMILY HOUSING SERVICES,886076
5110,2018,931231250,201843179349307049,UMATILLA BASIN WATERSHED FOUNDATION INC,68016
4712,2018,383849129,201843179349306644,HEARTS FOR HOSPICE,19565
6036,2018,930613470,201843179349306599,WILSONVILLE CHAMBER OF COMMERCE,153482
7108,2018,931276893,201843179349306194,FOUNDATION FOR FAMILY SCIENCE AND ENGINEERING,0
3764,2018,931187879,201843179349306069,HUMANE SOCIETY OF THE OCHOCOS,270067
3116,2018,930792490,201843179349305159,NORTHWEST GROCERY ASSOCIATION,550817
3006,2018,930578180,201843179349304084,ASPHALT PAVEMENT ASSOCIATION OF OREGON,358198
4198,2018,930687567,201843179349303884,KAPPA SIGMA NU ASSOCIATION INC,0
3974,2018,930902056,201843179349303864,AMERICAN FED OF STATE CNTY AND MUNI DBA 328 OR HEALTH SCIENCES UNIV EMP,0
4028,2018,931270846,201843179349303684,BOARDMAN COMMUNITY DEVELOPMENT ASSOCIATION,0
6608,2018,452590784,201843179349303559,NEW RILEY HOUSE,0
1726,2018,930847905,201843179349303439,HEALTH CARE FOR THE MID-COLUMBIA REGION,1259521
3380,2018,931234367,201843179349303034,SALEM INTERFAITH HOSPITALITY NETWORK,215414
5906,2018,462040546,201843179349302724,BEAVERTON POLICE ACTIVITIES LEAGUE,145127
5924,2018,936044347,201843179349302274,CORVALLIS OSU SYMPHONY SOCIETY,59664
4404,2018,930811197,201843169349305654,OREGON POTTERS ASSOCIATION,5000
6720,2018,931131757,201843169349304784,PIONEER COMMUNITY DEVELOPMENT CORPORATION,70506
3702,2018,936094816,201843169349303849,UMATILLA COUNTY HISTORICAL SOCIETY,121159
1120,2018,930977842,201843169349303599,COMMUNITY AND SHELTER ASSISTANCE CORP,1873637
1078,2018,930509906,201843169349303209,COLUMBIA RIVER MARITIME MUSEUM,1264274
4992,2018,930783407,201843169349303179,JAPAN AMERICA SOCIETY OF OREGON,151775
4066,2018,930551733,201843169349302934,HEMOPHILIA FOUNDATION OF OREGON,143478
6260,2018,931277268,201843169349302659,AGC OREGON COLUMBIA CHAPTER FOUNDATION,0
6576,2018,208790449,201843169349302344,COLUMBIA RIVER MARITIME MUSEUM ENDOWMENT TRUST,0
942,2018,237203564,201843169349300349,NATIONAL INTRAMURAL-RECREATIONAL SPORTS ASSOCIATION INC,2366593
1112,2018,237121915,201843169349300329,SNOWCAP COMMUNITY CHARITIES,456895
1632,2018,930936063,201843139349304009,MORNING STAR CHRISTIAN SCHOOL,1347551
2010,2018,936312666,201843139349303874,CONSTRUCTION INDUSTRY DRUG FREE WORKPLACE PROGRAM,0
1938,2018,936071709,201843139349303609,LESTA HOEL MEMORIAL TRUST FUND,0
1278,2018,204626312,201843139349303599,OREGON AND SOUTHERN IDAHO LABORERS - EMPLOYERS TRAINING TRUST FUND,688771
5126,2018,237111839,201843139349303429,OREGON PSYCHOLOGICAL ASSOCIATION,0
5840,2018,271248762,201843139349303369,ANGELS IN THE OUTFIELD,0
6834,2018,203306635,201843139349302724,NEWBERG EARLY BIRDS ROTARY FOUNDATION,0
5156,2018,237140608,201843139349302709,OREGON CABLE TELECOMMUNICATIONS ASSOCIATION,0
5366,2018,930357744,201843139349302439,LEBANON AREA CHAMBER OF COMMERCE,188450
2998,2018,930793142,201843139349302039,SHOKOOKAI OF PORTLAND CO YOSHIKO OBRIEN,421703
3710,2018,930979294,201843139349301744,ALBANY COMMUNITY AFTER SCHOOL PROGRAM,389288
3304,2018,721618287,201843139349301579,NORTH BY NORTHEAST COMMUNITY HEALTH CENTER,492872
564,2018,272028308,201843139349301389,ALLIANCE FOR A HEALTHIER GENERATION,11462949
1316,2018,710874661,201843129349302994,BEND VISITOR AND CONVENTION BUREAU DBA VISIT BEND,605649
910,2018,936002704,201843129349302964,CANNON BEACH CONFERENCE CENTER,1780758
0,2018,941105628,201843129349302544,KAISER FOUNDATION HOSPITALS,8438687895
2314,2018,930163375,201843129349302359,ANCIENT FREE AND ACCEPTED MASONS OF EUGENE LODGE 11,16800
4924,2018,930821866,201843129349302119,NAMI LANE COUNTY,151734
5894,2018,205289738,201843129349301589,NEXT GENERATION MINISTRIES,82986
7042,2018,930806812,201843119349302819,ST MARYS ACADEMY FOUNDATION OF THE DALLES,0
4602,2018,201975263,201843119349302239,FOREST PARK ELEMENTARY SCHOOL FOUNDATION,0
1690,2018,320305052,201843119349301769,OREGON HEALTH LEADERSHIP COUNCIL,178500
4994,2018,201615445,201843119349300004,BELLADONNA SANCTUARY,20000
1916,2018,453726266,201843109349302149,CRAWMERS CRITTERZ INC,1058073
1892,2018,208678122,201843109349302019,HEARTS WITH A MISSION,1403005
6686,2018,930397191,201843109349301544,SOUTHERN OREGON LABOR TEMPLE ASSOCIATION,0
7168,2018,261298799,201843109349301504,NORTH BEND SCHOOL FOUNDATION INC,0
3798,2018,931264722,201843099349302714,BOYS AND GIRLS CLUBS OF EMERALD VALLEY,365140
4640,2018,931108531,201843099349302519,BASIC RIGHTS OREGON,261360
3198,2018,930810393,201843099349302279,STRATEGIC ECONOMIC DEVELOPMENT CORPORATION OF THE MID-WILLAMETTE VALLEY,459890
2566,2018,930889144,201843099349301964,PROVIDENCE NEWBERG HEALTH FOUNDATION,166308
5238,2018,936030759,201843099349301324,KEIZER CHAMBER OF COMMERCE,101490
4748,2018,943029548,201843099349301234,KLAMATH KID CENTER INC,259933
3400,2018,931289894,201843099349300839,WILD RIVERS LAND TRUST,170752
6678,2018,936027273,201843069349301654,WOODBURN AREA CHAMBER OF COMMERCE,53724
4196,2018,930871161,201843069349301444,SUNRISE INTERNATIONAL MINISTRIES,315491
6428,2018,931027145,201843069349300339,KAPPA DELTA SORORITY-ALPHA LAMBDA,0
2338,2018,930919339,201843049349301844,MARYLHURST EARLY CHILDHOOD CENTER,925157
5454,2018,203201366,201843049349300349,ORI COMMUNITY AND EVALUATION SERVICES,226409
1518,2018,930147675,201843039349301064,CORVALLIS COUNTRY CLUB,1212251
3438,2018,411784046,201843029349301644,FUR COMMISSION USA INC,132179
5914,2018,931113346,201843029349300044,HOLY FAMILY ACADEMY,159607
7000,2018,931071429,201842999349301279,OPTIONS HOUSING ALTERNATIVES INC,17119
1176,2018,930616957,201842989349301314,HUMANE SOCIETY OF CENTRAL OREGON,1560065
2410,2018,911815618,201842989349300929,RENEWABLE NORTHWEST PROJECT,997000
4516,2018,931321759,201842959349300819,GRANDE RONDE ACADEMY,218334
3850,2018,203813278,201842929349301404,LIVE WIRE RADIO INC,289311
3384,2018,201821723,201842929349300234,ROSE CITY ROLLERS,256270
3830,2018,510191790,201842919349301399,COMMUNITY CENTER FOR THE PERFORMING ARTS,215839
5604,2018,912103401,201842919349301349,WASHINGTON C L U B CHARITY GOLF CLASSIC CO QUEST INVESTMENT MANAGEMENT LLC,0
7294,2018,931258164,201842919349300224,SPRINGFIELD RENAISSANCE DEVELOPMENT CORPORATION,0
546,2018,936227660,201842899349300824,NORTHWEST FIREFIGHTERS RELIEF ASSOCIATION,0
2528,2018,472609004,201842899349300104,DENTAL3,266402
4144,2018,930862641,201842889349302164,OREGON STATE CHAPTER PEO SISTERHOOD CHARITABLE TRUST,0
2530,2018,237334851,201842889349301934,NATIONAL ACADEMY OF ARTISTIC GYMNASTICS,427021
1064,2018,931148608,201842889349301774,CHILD FOUNDATION,529415
6398,2018,930570075,201842889349301384,EMERALD EMPIRE ART ASSOCIATION INC,61069
3470,2018,931073658,201842859349301109,WESTERN SOCIETY OF ALLERGY ASTHMA AND IMMUNOLOGY,0
4960,2018,364829234,201842859349300239,MALHEUR WATERSHED COUNCIL,0
4714,2018,930774594,201842849349301204,OREGON PHYSICIANS FOR SOCIAL RESPONSIBILITY,241638
1476,2018,930256275,201842849349300934,DISABLED AMERICAN VETERANS PORTLAND OREGON CHAPTER NO 1,228793
396,2018,930813981,201842839349301364,REACH COMMUNITY DEVELOPMENT INC,7321275
126,2018,936090239,201842839349301304,SCHOOL DISTRICT NO 1 HEALTH AND WELFARE TRUST FUND,0
4232,2018,930241594,201842839349301224,INDEPENDENT INSURANCE AGENTS AND BROKERS OF OREGON,0
6414,2018,931300045,201842839349301179,COMMUNITY HOUSING II INC,0
258,2018,930402877,201842839349301079,OREGON MUSEUM OF SCIENCE AND INDUSTRY,10529589
3550,2018,930919495,201842839349301054,HOYT ARBORETUM FRIENDS FOUNDATION,177706
5748,2018,930965136,201842839349300624,COOPER SPUR RACE TEAM,140786
4214,2018,311676770,201842839349300249,MT EMILY SAFE CENTER,282279
2070,2018,320237828,201842829349300249,GATEWAY TO COLLEGE NATIONAL NETWORK,1260676
5808,2018,800711747,201842819349300664,OREGON CAPITOL WATCH FOUNDATION,96000
5082,2018,930877416,201842809349300004,FEDERATION OF OREGON PAROLE AND PROB ATION OFFICERS,54745
4392,2018,475274064,201842789349301504,CWAYS HOME,20470
4502,2018,930555329,201842779349300909,MULTNOMAH HOT ROD COUNCIL,0
5788,2018,930504197,201842769349301149,MARION-POLK COUNTY MEDICAL SOCIETY,90469
6404,2018,943104390,201842759349301209,MT HOOD KIWANIS CAMP FOUNDATION INC,0
6364,2018,936025192,201842759349300854,MULTNOMAH DENTAL SOCIETY,105134
2628,2018,930331932,201842749349301109,BEND CHAMBER OF COMMERCE,734455
2412,2018,931309725,201842749349301074,SCIENCEWORKS HANDS-ON MUSEUM,598567
4036,2018,237115008,201842749349300439,CLACKAMAS COUNTY PEACE OFFICERS ASSN,0
6462,2018,936031635,201842699349301039,UNITED BROTHERHOOD OF CARPENTERS LOCAL 2784,18959
2194,2018,931299601,201842699349300519,VILLAGE FOCUS INTERNATIONAL,468131
4284,2018,462028748,201842689349300904,AMATEUR ATHLETIC UNION OF THE US TEAM FAST OREGON,0
684,2018,930568833,201842679349300954,MV ADVANCEMENTS,5765326
3690,2018,936022739,201842679349300019,WILLAMETTE SAILING CLUB,110017
7054,2018,930887878,201842609349301454,GLENCOE COMMUNITY FOOTBALL INC,0
6366,2018,930412513,201842609349301329,CONDON BPOE 1869,38384
6190,2018,936043858,201842609349301219,SALEM AREA SENIORS DBA KEIZERSALEM AREA SENIORS INC,0
6334,2018,931226388,201842579349301664,KLAMATH COMMUNITY YOUTH SPORTS COMP,18544
592,2018,930354500,201842579349301229,OREGON AFSCME COUNCIL 75,7237134
7226,2018,931174506,201842579349300994,KLAMATH COMMUNITY DEVELOPMENT CORP,0
1270,2018,930567341,201842569349300919,BIBLE MENNONITE FELLOWSHIP DBA ROCK OF AGES MENNONITE HOME,1917943
2758,2018,930196206,201842569349300854,INTL BROTHERHOOD OF TEAMSTERS LOCAL 324,583481
6864,2018,930687360,201842559349301044,INN BETWEEN SHELTER AND EVALUATION,78760
2636,2018,931230409,201842549349300724,GREEN EMPOWERMENT,425059
1372,2018,930900864,201842539349300419,YOUTH RIGHTS AND JUSTICE,2181624
5276,2018,271064431,201842499349301404,SOUND EQUINE OPTIONS,39888
3240,2018,930875209,201842499349301224,NAMI OREGON,196282
6508,2018,930778179,201842499349300414,MCMINNVILLE SWIM CLUB,89175
3108,2018,936134967,201842479349301284,OREGON AND SW WASHINGTON ROOFERS AND WATERPROOFERS APPRENTICESHIP,410505
4998,2018,930362839,201842479349301189,AMERICAN LEGION POST 168,53398
6310,2018,431964363,201842439349301214,CROOKED RIVER WEED MANAGEMENT AREA,43119
5856,2018,931241460,201842439349300854,KEMPLE MEMORIAL CHILDRENS CLINIC,153014
1038,2018,930721567,201842429349301154,CHAMBERLIN HOUSE INC,3011039
3078,2018,930593238,201842429349300439,OREGON RURAL ELECTRIC COOPERATIVE ASSN,410402
6804,2018,810877658,201842419349300804,GREATER HERMISTON COMMUNITY FOUNDATION,0
304,2018,510204735,201842419349300149,MATH LEARNING CENTER INC,2999942
4094,2018,270377378,201842409349300539,NORTHWEST ENERGY MANAGEMENT SERVICES,242686
4634,2018,936015296,201842409349300104,CAMP FIRE CENTRAL OREGON,260244
1728,2018,936031951,201842399349301024,PORTLAND METROPOLITAN ASSOCIATION OF REALTORS,1122652
2308,2018,930816161,201842399349300034,BOYS AND GIRLS CLUB OF SOUTHWESTERN OREGON,792597
3800,2018,930669285,201842369349300024,AINSWORTH AFTER SCHOOL CARE ASSN,452296
1578,2018,930399048,201842359349301119,WILLSON HOUSE,1746648
4314,2018,743103432,201842349349300139,LIVING YOGA,210318
3210,2018,930775640,201842329349301154,OREGONIANS FOR FOOD AND SHELTER INC,453987
1516,2018,931296840,201842289349301369,PORTLAND CLASSICAL CHINESE GARDEN DBA LAN SU CHINESE GARDEN,1179196
1446,2018,930243383,201842289349301209,OREGON DENTAL ASSOCIATION,885389
276,2018,931067253,201842279349302584,PACIFIC RETIREMENT SERVICES INC,9886907
1942,2018,931071103,201842279349302054,SPECIAL DELIVERY DENTAL CARE INC,897035
2640,2018,237232987,201842279349301844,KBOO FOUNDATION,568421
3386,2018,262429241,201842269349302584,HATCHERY ARTS,60395
3966,2018,930573791,201842269349302534,EAGLE FERN CAMP,201030
152,2018,383849354,201842269349302289,ASANTE PHYSICIAN PARTNERS,77162920
6978,2018,911829996,201842229349301259,MAZAMAS FOUNDATION,0
5566,2018,931207769,201842219349300634,TONYAS HOUSE INC,238518
4092,2018,43578179,201842209349301404,OTHER 98 PERCENT ACTION INC,406227
1936,2018,930338826,201842209349301109,OPERATIVE PLASTERERS AND CEMENT MASONS LOCAL NO 555,523892
3866,2018,930704993,201842199349300324,BLACK BUTTE RANCH WATER DIST COMPANY,132498
140,2018,936021113,201842189349301159,UNITED ASSOCIATION UNION LOCAL NO 290 PLUMBER STEAMFITTER AND SHIPFITTER INDUSTRY H AND W PLAN,0
694,2018,943029559,201842189349300969,OREGON TILTH INC,3924697
3294,2018,930818476,201842149349300744,DENTAL FOUNDATION OF OREGON,175617
1754,2018,930951954,201842129349300134,CONSTRUCTION INDUSTRY TRAINING TRUST,0
5016,2018,931063394,201842129349300109,ASTORIA SENIOR CENTER,47473
3972,2018,270413006,201842119349300999,MORNING STAR FOUNDATION,110612
4864,2018,261641869,201842079349300509,TARAHUMARA CHILDRENS HOSPITAL FUND,4346
3174,2018,930882559,201842009349300049,DOVE MEDICAL,322168
2282,2018,931208756,201841999349300649,SISTERS FOLK FESTIVAL INC,279460
4074,2018,931029326,201841989349300419,ALPHA LAMBDA HOUSE CORPORATION OF KAPPA DELTA SORORITY,56859
1544,2018,811344772,201841959349300609,COMPASS SCIENCE COMMUNICATION INC,1229006
4666,2018,522363626,201841929349300504,INTERNATIONAL POLICY NETWORK US INC,0
4626,2018,273067948,201841929349300039,ROCKWOOD MSC QALICB INC,0
6066,2018,943030030,201841849349300714,JOINT FORCES DANCE COMPANY,106844
4540,2018,391460266,201841839349301164,AMERICAN GERMAN SHEPHERD DOG CHARITABLE FOUNDATION INC,0
3672,2018,931112566,201841839349300954,GOLDEN BOND RESCUE OF OREGON INC,0
2984,2018,204145965,201841769349300019,AOET INTERNATIONAL COORDINATING OFFICE- USA DBA AOET-USA,191488
3640,2018,731634365,201841709349300129,SUDAN AFRICAN MISSION INC,52558
5834,2018,237318340,201841699349301359,OREGON ASSOCIATION OF TAX CONSULTAN,41262
2538,2018,470909658,201841659349300719,GRANDE RONDE MODEL WATERSHED FOUNDATION,0
7166,2018,237302688,201841659349300344,JESCO CLUB INC,7539
4812,2018,931144703,201841649349300649,RIVER GLEN ASSOCIATES INC,0
