,org_id,or_org,related_id,related_name
2969,930773410,1,930386823,LEGACY EMANUEL HOSPITAL & HEALTH CENTER
2970,930773410,1,930386793,LEGACY GOOD SAMARITAN HOSPITAL & MEDICAL
2971,930773410,1,930618975,LEGACY MERIDIAN PARK HOSPITAL
2972,930773410,1,930591528,LEGACY MOUNT HOOD MEDICAL CENTER
2973,930773410,0,331065485,LEGACY SALMON CREEK HOSPITAL
2974,930773410,1,930848530,LEGACY VISITING NURSE ASSOCIATION
2975,930773410,0,930695667,EMANUEL MEDICAL CENTER FOUNDATION
2976,930773410,1,931314469,RANDALL CHILDRENS HOSPITAL FOUNDATION
2977,930773410,1,237017276,GOOD SAMARITAN FOUNDATION
2978,930773410,1,930794951,MT HOOD MEDICAL CENTER FOUNDATION
2979,930773410,1,830433165,SALMON CREEK HOSPITAL FOUNDATION
2980,930773410,1,931121816,LEGACY ADVENTIST VENTURE
2981,930773410,1,465562403,LEGACY HEALTH FOUNDATION
2982,930773410,1,930281321,SILVERTON HEALTH
2983,930773410,1,930913392,SILVERTON HEALTH FOUNDATION
2984,930605471,1,931270935,OREGON JURY PROJECT
2985,930605471,0,936088690,OTLA PAC
2986,930802257,1,930556298,EUGENE SYMPHONY ASSOCIATION INC
2987,810670151,0,810670152,EQUALITY FEDERATION
2988,930777701,0,930591783,ROGUE COMMUNITY COLLEGE
2989,203372393,1,930784536,PHOENIX SCHOOL OF ROSEBURG CORP
2997,930855897,0,770274001,EARTH DAY 2020 INC
2998,930855897,0,205355252,ENVIRONMENT AMERICA INC
3003,930855897,0,582515543,GEORGIA PUBLIC INTEREST RESEARCH GR
3006,930855897,0,521818910,MARYPIRG CITIZEN LOBBY INC
3012,930855897,0,20611111,PENNENVIRONMENT INC
3014,930855897,0,770208947,PESTICIDE WATCH INC
3016,930855897,0,300599086,PROGRESS FLORIDA INC
3023,611541009,1,200195556,OCHIN INC
3024,20704277,1,352269965,SILETZ VALLEY EARLY COLLEGE ACADEMY
3025,743192567,1,930473211,MENNONITE HOME OF ALBANY INC
3026,743192567,1,931049860,ALBANY MENNONITE HOME VILLAGE FOUNDATION
3027,743192567,1,930916864,OREGON MENNONITE RESIDENTIAL SERVICES
3028,743192567,1,930865399,HOPE VILLAGE
3029,743192567,1,931313553,HOPE VILLAGE FOUNDATION INC
3030,930422242,1,943104390,MT HOOD KIWANIS CAMP FOUNDATION INC
3032,930633945,0,820553743,ORRA PAC
3033,431956560,1,930333988,HOOD RIVER ELECTRIC CO-OP
3034,930519716,0,841024566,NATIONAL PARK SERVICE
3037,930322985,0,530215427,INTL BROTHERHOOD OF TEAMSTERS
3038,930112705,1,237154746,PORTLAND VALLEY ACACIA FUND
3039,930112705,1,936024129,THE OREGON SCOTTISH RITE EDUCATION
3040,930112705,1,930811823,THE OREGON SCOTTISH RITE CLINICS
3041,930112705,0,824688837,PORTLAND SCOTTISH RITE TEMPLE
3042,931277774,1,300457438,SAFETY AND JUSTICE ACTION FUND
3043,930934830,1,911923482,ATNI - ECONOMIC DEVELOPMENT CORP
3044,930934830,0,680544296,ATNI - FINANCIAL SERVICES
3045,453724787,1,453719828,Eugene & Marlaina Johnston Foundation
3046,930138235,0,205501961,HELP THE CHAMBER KEEP SALEM LIVEABLE (CREATE JOBS PAC)
3047,930138235,0,811160373,BUILD JOBS PAC
3048,936071709,0,921062307,TERWILLIGER PLAZA FOUNDATION
3049,936071709,1,930477890,TERWILLIGER PLAZA INC
3050,204643206,0,931205946,INSTITUTE FOR WORLD EVANGELIZATION
3051,931330504,0,936000763,SALEM KEIZER SCHOOL DISTRICT
3052,205602442,1,943166095,Wild Salmon Center
3053,383709149,0,936000763,SALEM KEIZER SCHOOL DISTRICT
3054,911817635,1,931203198,VANCOUVER VILLAGE PROPERTIES INC
3055,930739188,1,453812405,COMMUNITY LENDINGWORKS
3056,830433165,1,237426300,LEGACY HEALTH
3057,830433165,0,331065485,LEGACY SALMON CREEK HOSPITAL
3058,830433165,1,930386823,LEGACY EMANUEL HOSPITAL & HEALTH CENTER
3059,830433165,1,930386793,LEGACY GOOD SAMARITAN HOSPITAL & MEDICAL
3060,830433165,1,930618975,LEGACY MERIDIAN PARK HOSPITAL
3061,830433165,1,930591528,LEGACY MOUNT HOOD MEDICAL CENTER
3062,830433165,1,930848530,LEGACY VISITING NURSE ASSOCIATION
3063,830433165,1,931314469,RANDALL CHILDRENS HOSPITAL FOUNDATION
3064,830433165,0,930695667,EMANUEL MEDICAL CENTER FOUNDATION
3065,830433165,1,237017276,GOOD SAMARITAN FOUNDATION
3066,830433165,1,930773410,MERIDIAN PARK MEDICAL FOUNDATION
3067,830433165,1,930794951,MT HOOD MEDICAL CENTER FOUNDATION
3068,830433165,1,931121816,LEGACY ADVENTIST VENTURE
3069,830433165,1,465562403,LEGACY HEALTH FOUNDATION
3070,830433165,1,930281321,SILVERTON HEALTH
3071,830433165,1,930913392,SILVERTON HEALTH FOUNDATION
3072,931032986,1,930820636,ROTARY CLUB OF ROSEBURG INC
3073,931266613,1,931108531,BASIC RIGHTS OREGON
3074,930115140,0,311713058,Ashland Chamber Foundation
3075,454726335,1,274764989,FORTH
3076,205922785,1,61706401,GREATER PORTLAND ECONOMOMIC DEVELOPMENT DISTRICT
3077,205922785,1,462572370,GREATER PORTLAND PARTNERSHIP FOR ECONOMIC ADVANCEMENT
3078,930168774,0,202541929,ROOFERS BUILDING ASSOCIATION
3079,930408077,1,911829996,THE MAZAMAS FOUNDATION
3080,930421613,1,930718331,SALEM ART ASSOCIATION ENDOWMENT FOUNDATION
3081,930421613,0,822528645,BUSH HOUSE MUSEUM
3082,467059268,1,237315673,The Oregon Community Foundation
3083,930195535,0,930391597,ODD FELLOWS HOME OF OREGON
3084,930195535,1,930613108,FRIENDSHIP HEALTH CENTER
3085,930195535,0,930740167,KENILWORTH PARK PLAZA
3086,472352652,1,931067253,PACIFIC RETIREMENT SERVICES INC
3087,472352652,1,930453216,ROGUE VALLEY MANOR
3088,472352652,0,750891470,THE CUMBERLAND REST INC
3089,472352652,1,930557803,CASCADE MANOR INC
3090,472352652,0,931179254,UNIVERSITY RETIREMENT COMMUNITY AT DAVIS
3091,472352652,1,930513697,HOLLADAY PARK PLAZA
3092,472352652,0,391412320,CAPITOL LAKES INC
3093,472352652,1,930712867,ROGUE VALLEY MANOR FOUNDATION INC
3094,472352652,0,931301816,UNIVERSITY RETIREMENT COMMUNITY FOUNDATION INC
3095,472352652,0,912162130,TRINITY TERRACE FOUNDATION INC
3096,472352652,1,264529118,HOLLADAY PARK PLAZA FOUNDATION INC
3097,472352652,0,450574348,MIRABELLA WASHINGTON FOUNDATION
3098,472352652,1,931330100,CASCADE MANOR FOUNDATION INC
3099,472352652,0,383781089,CAPITOL LAKES FOUNDATION INC
3100,472352652,0,342030255,MIRABELLA
3101,472352652,1,452508860,MIRABELLA PORTLAND FOUNDATION INC
3102,472352652,1,711016384,MIRABELLA AT SOUTH WATERFRONT
3103,472352652,1,930892261,COMMUNITY VOLUNTEER NETWORK
3104,472352652,1,930864466,RVM HOUSING CORPORATION
3105,472352652,1,930942933,RVM ASHLAND HOUSING CORPORATION
3106,472352652,1,943136037,RVM GRANTS PASS HOUSING CORPORATION
3107,472352652,1,943179782,RVM ROSEBURG HOUSING CORPORATION
3108,472352652,1,943162074,RVM MYRTLE CREEK HOUSING CORPORATION
3109,472352652,1,943163349,RVM BEND HOUSING CORPORATION
3110,472352652,1,943191447,RVM EAGLE POINT HOUSING CORPORATION
3111,472352652,1,943196455,RVM KLAMATH FALLS HOUSING CORPORATION
3112,472352652,1,943212537,RVM MEDFORD II HOUSING CORPORATION
3113,472352652,1,943194409,RVM LIVELY OAKS HOUSING CORPORATION
3114,472352652,1,943212538,RVM REEDSPORT HOUSING CORPORATION
3115,472352652,1,943212540,RVM YREKA HOUSING CORPORATION
3116,472352652,1,943247154,RVM EUGENE HOUSING CORPORATION
3117,472352652,1,311520436,RVM FORT WORTH I HOUSING CORPORATION
3118,472352652,1,943260016,RVM BEND II HOUSING CORPORATION
3119,472352652,1,311587415,RVM FORT WORTH II HOUSING CORPORATION
3120,472352652,1,311587418,RVM MEDFORD III HOUSING CORPORATION
3121,472352652,1,311587420,RVM ROSEBURG II HOUSING CORPORATION
3122,472352652,1,311662259,RVM GRANTS PASS II HOUSING CORPORATION
3123,472352652,1,311662208,RVM DAVIS HOUSING CORPORATION
3124,472352652,1,311715321,RVM MYRTLE CREEK II HOUSING CORPORATION
3125,472352652,1,311780332,RVM PORTLAND HOUSING CORPORATION
3126,472352652,1,300037898,RVM PORTLAND II HOUSING CORPORATION
3127,472352652,1,300315618,RVM CENTRAL POINT HOUSING CORPORATION
3128,472352652,1,900292647,RVM MANSFIELD HOUSING CORPORATION
3129,472352652,0,911859494,MIDDLETON GLEN INC
3130,472352652,0,470825736,SENIOR HOUSING OF MIDDLETON INC
3131,472352652,0,813784956,MIRABELLA AT ASU INC
3132,472352652,0,943008774,BAY AREA SENIOR SERVICES INC
3133,931170546,1,930425580,GOOD SHEPHERD HEALTH CARE SYSTEM
3134,930128630,0,464698508,BAC Pacific NW Administrative DC
3135,930834195,1,931306735,OREGON HUNTERS ASSOCIATION INC
3136,931057956,0,830886388,THE STREET TRUST ACTION FUND
3137,822972478,1,930728816,CENTRAL CITY CONCERN
3138,931121108,0,931150615,Oregon Horsemens Benevolent Foundation
3139,930639711,0,930383362,CONFEDERATED TRIBES OF WARM SPRINGS
3140,930784536,1,203372393,PHOENIX CHARTER
3141,931006823,1,931091617,RAGLAND RIFE FOUNDATION
3142,936097106,0,930585134,CHEMEKETA COMMUNITY COLLEGE
3143,930578180,0,262897482,ASPHALT PAVEMENT ASSOC OF OREGON ED FOUN
3144,930243395,0,931151316,OREGON STATE GRANGE FOUNDATION
3145,931155559,1,931189853,METZGER PARK APARTMENTS INC
3146,931155559,1,311501719,PRESERVE SPENCER HOUSE INC
3147,237067121,1,931254945,SHEPARD APARTMENTS INC
3148,270708680,1,472324722,Gisele Currier Scholarship Fund
3149,930196206,0,530215427,International Brotherhood of Teamsters
3150,364494477,0,936000763,Salem-Keizer School District 24J
3151,936027711,1,930407022,OREGON SHAKESPEARE FESTIVAL
3152,931085791,1,453804465,FARMERS MARKET FUND
3153,931319372,0,936000589,SOUTH LANE SCHOOL DISTRICT
3154,474077068,1,455496763,POCA TECHNICAL INSTITUTE
3155,273330368,1,473786430,GREEN SPORTS ALLIANCE FOUNDATION
3156,237259489,0,311379795,SNAG EDUCATION ENDOWMENT TRUST
3157,806116047,0,330563735,FONTANA POLICE OFFICERS' ASSOCIATION
3160,202430301,1,936030803,OREGON FFA ASSOCIATION
3161,474223651,0,936002204,City of McMinnville
3162,930803636,1,930700353,NARAL PRO-CHOICE OF OREGON
3164,237315437,1,202738888,MULTNOMAH BAR FOUNDATION
3165,930778635,0,825428423,OREGON ACADEMY OF GENERAL DENTISTRY FOUNDATION
3166,237058775,0,931198725,OREGONIANS FOR AFFORDABLE HOUSING
3167,931172258,0,911914868,HABITAT FOR HUMANITY INTERNATIONAL
3168,931088962,0,470399859,SERVANTS OF MARY
3169,352269965,1,20704277,SILETZ VALLEY SCHOOL
3170,931128220,0,936000566,Eugene School District 4J
3171,930913392,1,237426300,LEGACY HEALTH
3172,930913392,1,930281321,SILVERTON HEALTH
3173,930913392,1,930386823,LEGACY EMANUEL HOSPITAL & HEALTH CENTER
3174,930913392,1,930386793,LEGACY GOOD SAMARITAN HOSPITAL & MEDICAL
3175,930913392,1,930618975,LEGACY MERIDIAN PARK HOSPITAL
3176,930913392,1,930591528,LEGACY MOUNT HOOD MEDICAL CENTER
3177,930913392,0,331065485,LEGACY SALMON CREEK HOSPITAL
3178,930913392,1,930848530,LEGACY VISITING NURSE ASSOCIATION
3179,930913392,0,930695667,EMANUEL MEDICAL CENTER FOUNDATION
3180,930913392,1,931314469,RANDALL CHILDRENS HOSPITAL FOUNDATION
3181,930913392,1,930773410,MERIDIAN PARK MEDICAL FOUNDATION
3182,930913392,1,930794951,MT HOOD MEDICAL CENTER FOUNDATION
3183,930913392,1,830433165,SALMON CREEK HOSPITAL FOUNDATION
3184,930913392,1,931121816,LEGACY ADVENTIST VENTURE
3185,930913392,1,465562403,LEGACY HEALTH FOUNDATION
3186,943211472,1,931110745,OREGON SPORTS AUTHORITY FOUNDATION
3187,931208608,0,936000205,Corvallis School District 509J
3188,680556077,0,936000763,SALEM KEIZER SCHOOL DISTRICT
3189,930818476,1,930243383,OREGON DENTAL ASSOCIATION
3190,930818476,1,930438772,MODA HEALTH ODS
3191,930593238,0,470861601,OR ACTION COMMITTEE FOR RURAL ELECTRIFIC
3192,910267335,1,510432788,Center for Economic Devel Education
3193,936134967,1,930168774,UNITED UNION ROOFERS WATERPROOFERS
3196,930792490,0,931299493,NORTHWEST GROCERY ASSOCIATION PAC
3197,930792490,0,364595550,NORTHWEST GROCERY ASSOCIATION - WA PAC
3198,930792490,0,464231876,OREGONIANS FOR COMPETITION
3199,930792490,0,822168652,YES KEEP OUR GROCERIES TAX FREE
3200,237088818,1,936023043,Masonry Welfare Trust
3201,930667383,0,930508724,Regis High School
3202,931090612,1,237203564,NATIONAL INTRAUMURAL-RECREATIONAL SPORTS ASSOCIATION
3203,800436735,1,800697682,Family Forward Action Fund
3206,930884244,1,451801715,GROW OREGON
3207,930796366,1,930509906,COLUMBIA RIVER MARITIME MUSEUM
3208,930730486,1,930399048,UNITED METHODIST RETIREMENT CENTER
3209,931000082,0,131770417,YOUNG PRESIDENTS ORGANIZATION
3210,936031284,1,930269205,THE ROTARY CLUB OF PORTLAND
3211,931261580,1,237315673,The Oregon Community Foundation
3212,931144709,1,930977166,HUMAN SOLUTIONS INC
3213,931144709,1,273067948,ROCKWOOD MSC QALICB INC
3214,931144709,0,472559331,GLISAN COMMONS CONDOMINIUM ASSOCIATION
3215,930911198,0,352216430,OREGON WINE BOARD
3216,930911198,0,931250420,OREGON WINEGROWERS ASSOCIATION POLITICAL ACTION COMMITTEE
3217,930911198,0,202437849,TRUST FOR OREGON WINE EDUCATION AND RESEARCH
3218,237100856,0,930505508,Clatsop Community College
3219,61669651,1,61669649,NW EMPLOYMENT EDUCATION & DEFENSE FUND
3220,61669649,1,61669651,NORTHWEST WORKERS JUSTICE PROJECT
3223,931239982,0,930256955,HOME BUILDERS ASSOC OF METRO PORTLA
3224,930961591,1,930391547,OREGON COLLEGE OF ART AND CRAFT
3225,814978022,1,931192100,ASIAN HEALTH AND SERVICE CENTER
3226,270938109,1,943081823,ACCESSIBLE LIVING INC
3227,270938109,1,200070040,THE BRIDGE HOUSING CORPORATION
3228,473975911,0,453715012,BAY AREA LYME FOUNDATION
3229,473975911,0,463312992,BAY AREA LYME MAJOR GIFT FUND
3230,930766824,1,931268942,GTFF HEALTH & WELFARE TRUST
3231,930268510,1,481287863,OREGON FIRE CHIEFS FOUNDATION
3232,814453786,1,930354176,MORRISON CHILD AND FAMILY SERVICES
3233,931058377,1,931328927,ENTREPRENEURS FOUNDATION OF THE NORTHWEST
3234,930794951,1,237426300,LEGACY HEALTH
3235,930794951,1,930386823,LEGACY EMANUEL HOSPITAL & HEALTH CENTER
3236,930794951,1,930386793,LEGACY GOOD SAMARITAN HOSPITAL & MEDICAL
3237,930794951,1,930618975,LEGACY MERIDIAN PARK HOSPITAL
3238,930794951,1,930591528,LEGACY MOUNT HOOD MEDICAL CENTER
3239,930794951,0,331065485,LEGACY SALMON CREEK HOSPITAL
3240,930794951,1,930848530,LEGACY VISITING NURSE ASSOCIATION
3241,930794951,0,930695567,EMANUEL MEDICAL CENTER FOUNDATION
3242,930794951,1,931314469,RANDALL CHILDRENS HOSPITAL FOUNDATION
3243,930794951,1,237017276,GOOD SAMARITAN FOUNDATION
3244,930794951,1,930773410,MERIDIAN PARK MEDICAL FOUNDATION
3245,930794951,1,830433165,SALMON CREEK HOSPITAL FOUNDATION
3246,930794951,1,931121816,LEGACY ADVENTIST VENTURE
3247,930794951,1,465562403,LEGACY HEALTH FOUNDATION
3248,930794951,1,930281321,SILVERTON HEALTH
3249,930794951,1,930913392,SILVERTON HEALTH FOUNDATION
3251,930280615,0,433139608,HOUSE CORP FOR OREGON ALPHA OF SAE
3252,936030803,1,202430301,OREGON FFA FOUNDATION INC
3253,930474342,1,931253547,OREGON TELECOMMUNICATIONS ASSOCIATION SCHOLARSHIP FOUNDATION
3256,930892261,1,930942933,RVM Ashland Housing Corporation
3257,930892261,1,943163349,RVM Bend Housing Corporation
3258,930892261,1,943260016,RVM Bend II Housing Corporation
3259,930892261,1,300315618,RVM Central Point Housing Corporation
3260,930892261,1,311662208,RVM Davis Housing Corporation
3261,930892261,1,943191447,RVM Eagle Point Housing Corporation
3262,930892261,1,943247154,RVM Eugene Housing Corporation
3263,930892261,1,311520436,RVM Fort Worth Housing Corporation
3264,930892261,1,311587415,RVM Fort Worth II Housing Corporation
3265,930892261,1,943136037,RVM Grants Pass Housing Corporation
3266,930892261,1,311662259,RVM Grants Pass II Housing Corporation
3267,930892261,1,930864466,RVM Housing Corporation
3268,930892261,1,943196455,RVM Klamath Falls Housing Corporation
3269,930892261,1,943194409,RVM Lively Oaks Housing Corporation
3270,930892261,1,900292647,RVM Mansfield Housing Corporation
3271,930892261,1,943212537,RVM Medford II Housing Corporation
3272,930892261,1,311587418,RVM Medford III Housing Corporation
3273,930892261,1,943162074,RVM Myrtle Creek Housing Corporation
3274,930892261,1,311715321,RVM Myrtle Creek II Housing Corporation
3275,930892261,1,311780332,RVM Portland Housing Corporation
3276,930892261,1,300037898,RVM Portland II Housing Corporation
3277,930892261,1,943212538,RVM Reedsport Housing Corporation
3278,930892261,1,943179782,RVM Roseburg Housing Corporation
3279,930892261,1,311587420,RVM Roseburg II Housing Corporation
3280,930892261,1,943212540,RVM Yreka Housing Corporation
3281,930892261,0,391412320,Capitol Lakes Inc
3282,930892261,0,383781089,Capitol Lakes Foundation
3283,930892261,1,930557803,Cascade Manor Inc
3284,930892261,1,931330100,Cascade Manor Foundation
3285,930892261,1,930513697,Holladay Park Plaza
3286,930892261,1,264529118,Holladay Park Plaza Foundation
3287,930892261,0,342030255,Mirabella
3288,930892261,1,452508860,Mirabella Portland Foundation
3289,930892261,1,711016384,Mirabella at South Waterfront
3290,930892261,0,450574348,Mirabella Washington Foundation
3291,930892261,1,931067253,Pacific Retirement Services
3292,930892261,1,472352652,Pacific Retirement Services Foundation
3293,930892261,1,930453216,Rogue Valley Manor
3294,930892261,1,930712867,Rogue Valley Manor Foundation
3295,930892261,0,750891470,The Cumberland Rest Inc
3296,930892261,0,912162130,Trinity Terrace Foundation Inc
3297,930892261,0,931179254,University Retirement Community at Davis
3298,930892261,0,931301816,Univ Rtrmnt Comm at Davis Foundation
3299,930892261,0,813784956,MIRABELLA AT ASU INC
3300,930892261,0,943008774,Bay Area Senior Services Inc
3301,930575137,1,936023044,Cement Masons-Employers Trust
3302,930413990,1,930785430,Oregon Wheat Foundation
3303,930858825,1,931329784,SAMARITAN PACIFIC HEALTH SERVICES
3304,930858825,0,930603489,PACIFIC COMMUNITIES HEALTH DISTRICT
3305,943194409,1,930942933,RVM Ashland Housing Corporation
3306,943194409,1,943163349,RVM Bend Housing Corporation
3307,943194409,1,943260016,RVM Bend II Housing Corporation
3308,943194409,1,300315618,RVM Central Point Housing Corporation
3309,943194409,1,311662208,RVM Davis Housing Corporation
3310,943194409,1,943191447,RVM Eagle Point Housing Corporation
3311,943194409,1,943247154,RVM Eugene Housing Corporation
3312,943194409,1,311520436,RVM Fort Worth Housing Corporation
3313,943194409,1,311587415,RVM Fort Worth II Housing Corporation
3314,943194409,1,943136037,RVM Grants Pass Housing Corporation
3315,943194409,1,311662259,RVM Grants Pass II Housing Corporation
3316,943194409,1,930864466,RVM Housing Corporation
3317,943194409,1,943196455,RVM Klamath Falls Housing Corporation
3318,943194409,1,900292647,RVM Mansfield Housing Corporation
3319,943194409,1,943212537,RVM Medford II Housing Corporation
3320,943194409,1,311587418,RVM Medford III Housing Corporation
3321,943194409,1,943162074,RVM Myrtle Creek Housing Corporation
3322,943194409,1,311715321,RVM Myrtle Creek II Housing Corporation
3323,943194409,1,311780332,RVM Portland Housing Corporation
3324,943194409,1,300037898,RVM Portland II Housing Corporation
3325,943194409,1,943212538,RVM Reedsport Housing Corporation
3326,943194409,1,943179782,RVM Roseburg Housing Corporation
3327,943194409,1,311587420,RVM Roseburg II Housing Corporation
3328,943194409,1,943212540,RVM Yreka Housing Corporation
3329,943194409,1,930892261,Community Volunteer Network
3330,943194409,0,391412320,Capitol Lakes Inc
3331,943194409,0,383781089,Capitol Lakes Foundation
3332,943194409,1,930557803,Cascade Manor Inc
3333,943194409,1,931330100,Cascade Manor Foundation
3334,943194409,1,930513697,Holladay Park Plaza
3335,943194409,1,264529118,Holladay Park Plaza Foundation
3336,943194409,0,342030255,Mirabella
3337,943194409,1,452508860,Mirabella Portland Foundation
3338,943194409,1,711016384,Mirabella at South Waterfront
3339,943194409,0,450574348,Mirabella Washington Foundation
3340,943194409,1,931067253,Pacific Retirement Services
3341,943194409,1,472352652,Pacific Retirement Services Foundation
3342,943194409,1,930453216,Rogue Valley Manor
3343,943194409,1,930712867,Rogue Valley Manor Foundation
3344,943194409,0,750891470,The Cumberland Rest Inc
3345,943194409,0,912162130,Trinity Terrace Foundation Inc
3346,943194409,0,931179254,University Retirement Community at Davis
3347,943194409,0,931301816,Univ Rtrmnt Comm at Davis Foundation
3348,943194409,0,813784956,MIRABELLA AT ASU INC
3349,943194409,0,943008774,Bay Area Senior Services Inc
3350,208790449,1,930509906,COLUMBIA RIVER MARITIME MUSEUM
3351,930704993,1,237115837,BLACK BUTTE RANCH ASSOCIATION
3352,930683005,1,931176313,OREGON STUDENT FOUNDATION
3353,930438697,0,530215427,INTERNATIONAL BROTHERHOOD OF TEAMSTERS
3354,510153335,1,930593128,OREGON RIGHT TO LIFE
3355,510153335,1,931320700,STANDUPGIRLCOM FOUNDATION
3356,510153335,0,930785781,OREGON RIGHT TO LIFE POLITICAL ACTION COMMITTEE
3357,510153335,0,811057386,OREGON RIGHT TO LIFE VICTORY PAC
3361,930196193,0,530215427,INTL BROTHERHOOD OF TEAMSTERS
3362,930196193,0,910436963,TEAMSTERS LOCAL UNION NO 58
3363,930196193,1,930438697,TEAMSTERS LOCAL UNION NO 81
3364,930196193,1,930196219,TEAMSTERS LOCAL UNION NO 162
3365,930196193,1,930306515,TEAMSTERS LOCAL UNION NO 206
3366,930196193,1,930179776,TEAMSTERS LOCAL UNION NO 223
3367,930196193,1,930151383,TEAMSTERS LOCAL UNION NO 305
3368,930196193,1,930196206,TEAMSTERS LOCAL UNION NO 324
3369,930196193,1,930322985,TEAMSTERS LOCAL UNION NO 670
3370,930196193,1,930236781,TEAMSTERS LOCAL UNION NO 962
3371,930196193,1,931039446,PORTLAND TEAMSTERS BUILDING INC
3372,930280680,0,540379370,SIGMA PHI EPSILON FRATERNITY
3373,930280680,0,936031204,OREGON ALPHA ALUMNI ASSOCIATION
3374,460545789,1,930591240,OREGON CHILD DEVELOPMENT COALITION
3375,936023450,1,930471873,Rose Villa Inc
3376,270377378,1,270231596,NORTHWEST ENERGY SUPPLY COOP (NESC)
3377,311662208,1,930942933,RVM Ashland Housing Corporation
3378,311662208,1,943163349,RVM Bend Housing Corporation
3379,311662208,1,943260016,RVM Bend II Housing Corporation
3380,311662208,1,300315618,RVM Central Point Housing Corporation
3381,311662208,1,943191447,RVM Eagle Point Housing Corporation
3382,311662208,1,943247154,RVM Eugene Housing Corporation
3383,311662208,1,311520436,RVM Fort Worth Housing Corporation
3384,311662208,1,311587415,RVM Fort Worth II Housing Corporation
3385,311662208,1,943136037,RVM Grants Pass Housing Corporation
3386,311662208,1,311662259,RVM Grants Pass II Housing Corporation
3387,311662208,1,930864466,RVM Housing Corporation
3388,311662208,1,943196455,RVM Klamath Falls Housing Corporation
3389,311662208,1,943194409,RVM Lively Oaks Housing Corporation
3390,311662208,1,900292647,RVM Mansfield Housing Corporation
3391,311662208,1,943212537,RVM Medford II Housing Corporation
3392,311662208,1,311587418,RVM Medford III Housing Corporation
3393,311662208,1,943162074,RVM Myrtle Creek Housing Corporation
3394,311662208,1,311715321,RVM Myrtle Creek II Housing Corporation
3395,311662208,1,311780332,RVM Portland Housing Corporation
3396,311662208,1,300037898,RVM Portland II Housing Corporation
3397,311662208,1,943212538,RVM Reedsport Housing Corporation
3398,311662208,1,943179782,RVM Roseburg Housing Corporation
3399,311662208,1,311587420,RVM Roseburg II Housing Corporation
3400,311662208,1,943212540,RVM Yreka Housing Corporation
3401,311662208,1,930892261,Community Volunteer Network
3402,311662208,0,391412320,Capitol Lakes Inc
3403,311662208,0,383781089,Capitol Lakes Foundation
3404,311662208,1,930557803,Cascade Manor Inc
3405,311662208,1,931330100,Cascade Manor Foundation
3406,311662208,1,930513697,Holladay Park Plaza
3407,311662208,1,264529118,Holladay Park Plaza Foundation
3408,311662208,0,342030255,Mirabella
3409,311662208,1,452508860,Mirabella Portland Foundation
3410,311662208,1,711016384,Mirabella at South Waterfront
3411,311662208,0,450574348,Mirabella Washington Foundation
3412,311662208,1,931067253,Pacific Retirement Services
3413,311662208,1,472352652,Pacific Retirement Services Foundation
3414,311662208,1,930453216,Rogue Valley Manor
3415,311662208,1,930712867,Rogue Valley Manor Foundation
3416,311662208,0,750891470,The Cumberland Rest Inc
3417,311662208,0,912162130,Trinity Terrace Foundation Inc
3418,311662208,0,931179254,University Retirement Community at Davis
3419,311662208,0,931301816,Univ Rtrmnt Comm at Davis Foundation
3420,311662208,0,813784956,Mirabella at ASU Inc
3421,311662208,0,943008774,Bay Area Senior Services Inc
3422,202021524,1,930619733,Portland State University Foundation
3423,930862641,0,237030111,OREGON STATE CHAPTER
3424,237023370,0,743111733,RIVERDALE SCHOOL DISTRICT
3425,300792170,0,710931219,HOUSING EMPLOYMENT AND LEARNING PROGRAMS FOR SELF-SUFFICIENCY
3426,300792170,1,931099406,LINN BENTON FOOD SHARE
3427,300792170,0,311751886,HEAD START OF LINCOLN COUNTY
3428,300792170,0,936118438,COMMUNITY SERVICES CONSORTIUM
3429,931329192,1,931057208,NEIGHBORWORKS UMPQUA
3430,931176313,1,930683005,OREGON STUDENT ASSOCIATION
3431,527320419,1,930266190,RIVER VIEW CEMETERY ASSOCIATION
3432,451801715,1,930884244,OREGON BUSINESS COUNCIL
3433,271265550,0,931316567,CLEAN WATER SERVICES
3434,930215270,0,361408120,MOOSE INTERNATIONAL
3435,931327535,1,931318144,COASTER THEATER FOUNDATION
3437,237181999,1,930391586,Linfield College
3438,930718331,1,930421613,SALEM ART ASSOCIATION
3439,931144703,1,930814473,NORTHWEST HOUSING ALTERNATIVES
3440,311677531,0,936118438,COMMUNITY SERVICES CONSORTIUM
3441,930775337,0,930770892,Chemeketa Non-Profit Housing Inc
3442,931108531,1,931266613,BASIC RIGHTS EDUCATION FUND
3443,931110745,1,943211472,OREGON SPORTS AUTHORITY
3444,821096766,1,943038729,REACH INC
3445,936036653,0,530197094,NPS - FORT CLATSOP UNIT
3446,943180347,0,936001786,UNIVERSITY OF OREGON ATHLETIC DEPARTMENT
3447,930423900,1,931150833,OREGON ACADEMY OF FAMILY PHYSICIANS
3448,931216398,1,930814473,NORTHWEST HOUSING ALTERNATIVES INC
3449,936024129,1,930112705,ANCIENT AND ACCEPTED SCOTTISH RITE
3450,936024129,1,237154746,PORTLAND VALLEY ACACIA FUND
3451,943247154,1,930942933,RVM Ashland Housing Corporation
3452,943247154,1,943163349,RVM Bend Housing Corporation
3453,943247154,1,943260016,RVM Bend II Housing Corporation
3454,943247154,1,300315618,RVM Central Point Housing Corporation
3455,943247154,1,311662208,RVM Davis Housing Corporation
3456,943247154,1,943191447,RVM Eagle Point Housing Corporation
3457,943247154,1,311520436,RVM Fort Worth Housing Corporation
3458,943247154,1,311587415,RVM Fort Worth II Housing Corporation
3459,943247154,1,943136037,RVM Grants Pass Housing Corporation
3460,943247154,1,311662259,RVM Grants Pass II Housing Corporation
3461,943247154,1,930864466,RVM Housing Corporation
3462,943247154,1,943196455,RVM Klamath Falls Housing Corporation
3463,943247154,1,943194409,RVM Lively Oaks Housing Corporation
3464,943247154,1,900292647,RVM Mansfield Housing Corporation
3465,943247154,1,943212537,RVM Medford II Housing Corporation
