,org_id,or_org,related_id,related_name
3921,943163349,1,943191447,RVM Eagle Point Housinc Corporation
3922,943163349,1,943247154,RVM Eugene Housing Corporation
3923,943163349,1,311520436,RVM Fort Worth Housing Corporation
3924,943163349,1,311587415,RVM Fort Worth II Housing Corporation
3925,943163349,1,943136037,RVM Grants Pass Housing Corporation
3926,943163349,1,311662259,RVM Grants Pass II Housing Corporation
3927,943163349,1,930864466,RVM Housing Corporation
3928,943163349,1,943196455,RVM Klamath Falls Housing Corporation
3929,943163349,1,943194409,RVM Lively Oaks Housing Corporation
3930,943163349,1,900292647,RVM Mansfield Housing Corporation
3931,943163349,1,943212537,RVM Medford II Housing Corporation
3932,943163349,1,311587418,RVM Medford III Housing Corporation
3933,943163349,1,943162074,RVM Myrtle Creek Housing Corporation
3934,943163349,1,311715321,RVM Myrtle Creek II Housing Corporation
3935,943163349,1,311780332,RVM Portland Housing Corporation
3936,943163349,1,300037898,RVM Portland II Housing Corporation
3937,943163349,1,943212538,RVM Reedsport Housing Corporation
3938,943163349,1,943179782,RVM Roseburg Housing Corporation
3939,943163349,1,311587420,RVM Roseburg II housing Corporation
3940,943163349,1,943212540,RVM Yreka Housing Corporation
3941,943163349,1,930892261,Community Volunteer Network
3942,943163349,0,391412320,Capitol Lakes Inc
3943,943163349,0,383781089,Capitol Lakes Foundation
3944,943163349,1,930557803,Cascade Manor Inc
3945,943163349,1,931330100,Cascade Manor Foundation
3946,943163349,1,930513697,Holladay Park Plaza
3947,943163349,1,264529118,Holladay Park Plaza Foundation
3948,943163349,0,342030255,Mirabella
3949,943163349,1,452508860,Mirabella Portland Foundation
3950,943163349,1,711016384,Mirabella at South Waterfront
3951,943163349,0,450574348,Mirabella Washington Foundation
3952,943163349,1,931067253,Pacific Retirement Service
3953,943163349,1,472352652,Pacific Retirement Services Foundation
3954,943163349,1,930453216,Rogue Valley Manor
3955,943163349,1,930712867,Rogue Valley Manor Foundation
3956,943163349,0,750891470,The Cumberland Rest Inc
3957,943163349,0,912162130,Trinity Terrace Foundation Inc
3958,943163349,0,931179254,University Retiremen Community at Davis
3959,943163349,0,931301816,Univ Rtrmnt Comm at Davis Foundation
3960,943163349,0,813784956,MIRABELLA AT ASU INC
3961,943163349,0,943008774,Bay Area Senior Services Inc
3962,455496763,1,474077068,WORKING CLASS ACUPUNCTURE INC
3963,931138243,0,930628532,MID-WILLAMETTE VALLEY COUNCIL OF GOVERNMENTS
3965,931290307,0,931221597,OREGON FAMILY COUNCIL PAC
3966,931290307,1,743096375,OREGON FAMILY COUNCIL EDUCATION FD
3967,943051415,0,261114708,JOSEPHINE COMMUNITY LIBRARIES INC
3968,930253202,0,262511045,pi beta phi fraternity housing corp
3969,930427037,1,931149996,THE PORTLAND GARDEN CLUB FOUNDATION
3970,930688381,0,910939479,PEACEHEALTH
3972,270745177,0,936000591,Bethel School District
3973,841641552,1,930495706,OREGON ASSOCIATION OF REALTORS
3974,43774565,1,930386852,ROBISON JEWISH HOME
3975,43774565,1,454839314,CSP KEHILLA HOUSING
3976,43774565,0,208504069,SINAI FAMILY HOME SERVICES INC
3977,43774565,1,930386851,JEWISH FAMILY AND CHILD SERVICE
3978,311587415,1,930942933,RVM Ashland Housing Corporation
3979,311587415,1,943163349,RVM Bend Housing Corporation
3980,311587415,1,943260016,RVM Bend II Housing Corporation
3981,311587415,1,300315618,RVM Central Point Housing Corporation
3982,311587415,1,311662208,RVM Davis Housing Corporation
3983,311587415,1,943191447,RVM Eagle Point Housing Corporation
3984,311587415,1,943247154,RVM Eugene Housing Corporation
3985,311587415,1,311520436,RVM Fort Worth Housing Corporation
3986,311587415,1,943136037,RVM Grants Pass Housing Corporation
3987,311587415,1,311662259,RVM Grants Pass II Housing Corporation
3988,311587415,1,930864466,RVM Housing Corporation
3989,311587415,1,943196455,RVM Klamath Falls Housing Corporation
3990,311587415,1,943194409,RVM Lively Oaks Housing Corporation
3991,311587415,1,900292647,RVM Mansfield Housing Corporation
3992,311587415,1,943212537,RVM Medford II Housing Corporation
3993,311587415,1,311587418,RVM Medford III Housing Corporation
3994,311587415,1,943162074,RVM Myrtle Creek Housing Corporation
3995,311587415,1,311715321,RVM Myrtle Creek II Housing Corporation
3996,311587415,1,311780332,RVM Portland Housing Corporation
3997,311587415,1,300037898,RVM Portland II Housing Corporation
3998,311587415,1,943212538,RVM Reedsport Housing Corporation
3999,311587415,1,943179782,RVM Roseburg Housing Corporation
4000,311587415,1,311587420,RVM Roseburg II Housing Corporation
4001,311587415,1,943212540,RVM Yreka Housing Corporation
4002,311587415,1,930892261,Community Volunteer Network
4003,311587415,0,391412320,Capitol Lakes Inc
4004,311587415,0,383781089,Capitol Lakes Foundation
4005,311587415,1,930557803,Cascade Manor Inc
4006,311587415,1,931330100,Cascade Manor Foundation
4007,311587415,1,930513697,Holladay Park Plaza
4008,311587415,1,264529118,Holladay Park Plaza Foundation
4009,311587415,0,342030255,Mirabella
4010,311587415,1,452508860,Mirabella Portland Foundation
4011,311587415,1,711016384,Mirabella at South Waterfront
4012,311587415,0,450574348,Mirabella Washington Foundation
4013,311587415,1,931067253,Pacific Retirement Services
4014,311587415,1,472352652,Pacific Retirement Services Foundation
4015,311587415,1,930453216,Rogue Valley Manor
4016,311587415,1,930712867,Rogue Valley Manor Foundation
4017,311587415,0,750891470,The Cumberland Rest Inc
4018,311587415,0,912162130,Trinity Terrace Foundation Inc
4019,311587415,0,931179254,University Retirement Community at Davis
4020,311587415,0,931301816,Univ Rtrmnt Comm at Davis Foundation
4021,311587415,0,813784956,MIRABELLA AT ASU INC
4022,311587415,0,943008774,Bay Area Senior Services Inc
4023,930593128,1,510153335,OREGON RIGHT TO LIFE EDUCATION FOUNDATION
4024,930593128,1,931320700,STANDUPGIRLCOM FOUNDATION
4025,930593128,0,930785781,OREGON RIGHT TO LIFE POLITICAL ACTION COMMITTEE
4026,930593128,0,811057386,OREGON RIGHT TO LIFE VICTORY PAC
4027,202683560,0,272491974,ADVANTAGE HEALTHSAINT MARY'S MEDICAL GROUP
4028,202683560,0,581492325,ALLEGANY FRANCISCAN MINISTRIES INC
4029,202683560,0,61450170,ASYLUM HILL FAMILY MEDICINE CENTER INC
4030,202683560,0,421500277,BAUM HARMON MERCY HOSPITAL
4031,202683560,0,262973307,BAUM HARMON MERCY HOSPITAL AND CLINICS FOUNDATION
4032,202683560,0,141651563,BEECHWOOD INC
4033,202683560,0,251436685,BETHLEHEM HAVEN OF PITTSBURGH
4034,202683560,0,141717028,BEVERWYCK INC
4035,202683560,0,42182395,BRIGHTSIDE INC
4036,202683560,0,141701597,CAPITAL REGION GERIATRIC CENTER INC
4037,202683560,0,201681131,CARING PARTNERS HOME HEALTH INC
4038,202683560,0,382507173,CATHERINE MCAULEY HEALTH SERVICES CORP
4040,202683560,0,262616342,COLUMBUS ACQUISITION CORP
4041,202683560,0,342032340,DILEY RIDGE MEDICAL CENTER
4042,202683560,0,262227941,DUBUQUE MERCY HEALTH FOUNDATION
4043,202683560,0,205383271,DYERSVILLE HEALTH FOUNDATION INC
4044,202683560,0,232515999,EAST NORRITON PHYSICIANS SERVICES INC
4045,202683560,0,141818568,EDDY LICENSED HOME CARE AGENCY
4046,202683560,0,461051881,EMBRACING AGE INC
4047,202683560,0,141795732,EMPIRE HOME INFUSION SERVICE INC
4048,202683560,0,42501711,FARREN CARE CENTER INC
4049,202683560,0,223008680,FRANCISCAN ELDERCARE CORPORATION
4050,202683560,0,208072723,GLACIER HILLS FOUNDATION
4051,202683560,0,381891500,GLACIER HILLS INC
4052,202683560,0,141794150,GLEN EDDY INC
4053,202683560,0,421253527,GLOBAL HEALTH MINISTRY
4054,202683560,0,261720984,GOOD SAMARITAN HOSPITAL INC
4055,202683560,0,363332852,GOTTLIEB COMMUNITY HEALTH SERVICES CORPORATION
4056,202683560,0,743260011,GOTTLIEB MEMORIAL FOUNDATION
4057,202683560,0,362379649,GOTTLIEB MEMORIAL HOSPITAL
4058,202683560,0,237270669,GRAND RAPIDS MEDICAL EDUCATION PARTNERS
4059,202683560,0,381386362,HACKLEY LIFE COUNSELING
4060,202683560,0,800102840,HAWTHORNE RIDGE INC
4061,202683560,0,830416893,HEART CENTER OF GREATER WATERBURY INC
4062,202683560,0,141725101,HERITAGE HOUSE NURSING CENTER INC
4063,202683560,0,521945054,HOLY CROSS CARENET INC
4064,202683560,0,208428450,HOLY CROSS HEALTH FOUNDATION INC
4065,202683560,0,520738041,HOLY CROSS HEALTH INC
4066,202683560,0,590791028,HOLY CROSS HOSPITAL INC
4067,202683560,0,465421068,HOLY CROSS OUTPATIENT SERVICES INC
4068,202683560,0,812531495,HOLY CROSS PRIMARY CARE INC
4069,202683560,0,810723591,HOME & COMMUNITY HEALTH SERVICES INC
4070,202683560,0,141514867,HOME AIDE SERVICE OF EASTERN NEW YORK INC
4071,202683560,0,421173708,HOSPICE OF NORTH IOWA
4072,202683560,0,383320710,HOSPICE OF SIOUXLAND
4073,202683560,0,383316559,IHA HEALTH SERVICES CORPORATION
4074,202683560,0,475676956,JOHNSON MEMORIAL HOSPITAL INC
4075,202683560,0,232519529,LANGHORNE MRI INC
4076,202683560,0,232571699,LANGHORNE PHYSICIAN SERVICES INC
4077,202683560,0,261854750,LIFE AT LOURDES INC
4078,202683560,0,452569214,LIFE AT ST FRANCIS HEALTHCARE INC
4079,202683560,0,222797282,LIFE ST FRANCIS CORPORATION
4080,202683560,0,272159847,LIFE ST JOSEPH OF THE PINES INC
4081,202683560,0,262976184,LIFE ST MARY
4082,202683560,0,222568525,LOURDES ANCILLARY SERVICES
4083,202683560,0,274357794,LOURDES CARDIOLOGY SERVICES PC
4084,202683560,0,223612265,LOURDES MEDICAL CENTER OF BURLINGTON COUNTY
4085,202683560,0,474147171,LOYOLA MEDICINE TRANSPORT LLC
4086,202683560,0,363342448,LOYOLA UNIVERSITY HEALTH SYSTEM
4087,202683560,0,364015560,LOYOLA UNIVERSITY MEDICAL CENTER
4088,202683560,0,222564710,LTC (EDDY) INC
4089,202683560,0,383320705,MARIAN HOME HEALTHCARE
4090,202683560,0,911940902,MAXIS HEALTH SYSTEM
4091,202683560,0,61058086,MCAULEY CENTER INC
4092,202683560,0,382561013,MCAULEY CLINIC CORPORATION
4093,202683560,0,943436142,MCAULEY MINISTRIES
4094,202683560,0,141338457,MEMORIAL HOSPITAL ALBANY NY
4095,202683560,0,383320698,MERCY AMICARE HOME HEALTHCARE OAKLAND
4096,202683560,0,581448522,MERCY CARE FOUNDATION INC
4097,202683560,0,231352191,MERCY CATHOLIC MEDICAL CENTER OF SOUTHEASTERN PENNSYLVANIA
4098,202683560,0,61492707,MERCY COMMUNITY HEALTH INC
4099,202683560,0,232325059,MERCY FAMILY SUPPORT
4100,202683560,0,363227350,MERCY FOUNDATION INC
4101,202683560,0,383321856,MERCY GENERAL HEALTH PARTNERS AMICARE HOMECARE
4102,202683560,0,232829864,MERCY HEALTH FOUNDATION OF SOUTHEASTERN PENNSYLVANIA
4103,202683560,0,421478417,MERCY HEALTH NETWORK INC
4104,202683560,0,382589966,MERCY HEALTH PARTNERS
4105,202683560,0,222483605,MERCY HEALTH PLAN
4106,202683560,0,311373080,MERCY HEALTH SERVICES - IOWA CORP
4107,202683560,0,363163327,MERCY HEALTH SYSTEM OF CHICAGO
4108,202683560,0,232212638,MERCY HEALTH SYSTEM OF SOUTHEASTERN PENNSYLVANIA
4109,202683560,0,150532211,MERCY HEALTHCARE CENTER
4110,202683560,0,421316126,MERCY HEALTHCARE FOUNDATION - CLINTON
4111,202683560,0,231352099,MERCY HOME HEALTH
4112,202683560,0,232325058,MERCY HOME HEALTH SERVICES
4113,202683560,0,362170152,MERCY HOSPITAL AND MEDICAL CENTER
4114,202683560,0,203357131,MERCY HOSPITAL CADILLAC FOUNDATION
4115,202683560,0,251604115,MERCY LIFE CENTER CORPORATION
4116,202683560,0,273163002,MERCY LIFE OF ALABAMA
4117,202683560,0,453086711,MERCY LIFE INC
4118,202683560,0,232627944,MERCY MANAGEMENT OF SOUTHEASTERN PENNSYLVANIA
4119,202683560,0,421336618,MERCY MEDICAL CENTER - CLINTON INC
4120,202683560,0,141880022,MERCY MEDICAL CENTER - SIOUX CITY FOUNDATION
4121,202683560,0,421229151,MERCY MEDICAL CENTER FOUNDATION - NORTH IOWA
4122,202683560,0,636002215,MERCY MEDICAL CORPORATION
4123,202683560,0,454884805,MERCY MEDICAL GROUP INC
4124,202683560,0,461187365,MERCY PHYSICIAN NETWORK
4125,202683560,0,581366508,MERCY SENIOR CARE INC
4126,202683560,0,272046353,MERCY SERVICES DOWNTOWN INC
4127,202683560,0,382719605,MERCY SERVICES FOR AGING NONPROFIT HOUSING CORPORATION
4128,202683560,0,264033168,MERCY SPECIALIST PHYSICIANS INC
4129,202683560,0,231396763,MERCY SUBURBAN HOSPITAL
4130,202683560,0,161535133,MERCY UIHLEIN HEALTH CORPORATION
4131,202683560,0,383181557,MISSION HEALTH CORPORATION
4132,202683560,0,311308555,MOUNT CARMEL COLLEGE OF NURSING
4133,202683560,0,251912781,MOUNT CARMEL HEALTH INSURANCE COMPANY
4134,202683560,0,311471229,MOUNT CARMEL HEALTH PLAN INC
4135,202683560,0,311439334,MOUNT CARMEL HEALTH SYSTEM
4136,202683560,0,311113966,MOUNT CARMEL HEALTH SYSTEM FOUNDATION
4137,202683560,0,222584082,MOUNT SINAI HOSPITAL FOUNDATION INC
4138,202683560,0,61422973,MOUNT SINAI REHABILITATION HOSPITAL INC
4139,202683560,0,10274998,MOUNT ST JOSEPH
4140,202683560,0,383073745,MRI MOBILE SERVICES OF WEST MICHIGAN
4141,202683560,0,911932918,MUSKEGON COMMUNITY HEALTH PROJECT
4142,202683560,0,232300951,NAZARETH HEALTH CARE FOUNDATION
4143,202683560,0,232794121,NAZARETH HOSPITAL
4144,202683560,0,203261266,NAZARETH PHYSICIAN SERVICES INC
4145,202683560,0,232497355,NE PHYSICIAN SERVICES INC
4146,202683560,0,208072234,OAKLAND MERCY HOSPITAL
4147,202683560,0,311678345,OAKLAND MERCY HOSPITAL FOUNDATION
4148,202683560,0,311654603,OSUMOUNT CARMEL HEALTH ALLIANCE
4149,202683560,0,222568528,OUR LADY OF LOURDES HEALTH CARE SERVICES INC
4150,202683560,0,222351960,OUR LADY OF LOURDES HEALTH FOUNDATION INC
4151,202683560,0,210635001,OUR LADY OF LOURDES MEDICAL CENTER INC
4152,202683560,0,141743506,OUR LADY OF MERCY LIFE CENTER
4153,202683560,0,454208896,PIONEER VALLEY CARDIOLOGY ASSOCIATES INC
4154,202683560,0,251464211,PITTSBURGH MERCY HEALTH SYSTEM INC
4155,202683560,0,202020239,PROBILITY THERAPY SERVICES
4156,202683560,0,382638284,PROFESSIONAL MED TEAM
4157,202683560,0,811807730,RIVERBEND MEDICAL GROUP INC
4158,202683560,0,271763712,SJ MANAGEMENT COMPANY OF SYRACUSE INC
4159,202683560,0,941437713,SAINT AGNES MEDICAL CENTER
4160,202683560,0,942839324,SAINT AGNES MEDICAL FOUNDATION
4161,202683560,0,820401011,SAINT ALPHONSUS BUILDING COMPANY INC
4162,202683560,0,943028978,SAINT ALPHONSUS DIVERSIFIED CARE INC
4163,202683560,1,943164869,SAINT ALPHONSUS FOUNDATION-BAKER CITY INC
4164,202683560,1,202683560,SAINT ALPHONSUS FOUNDATION-ONTARIO INC
4165,202683560,0,271929502,SAINT ALPHONSUS HEALTH SYSTEM INC
4166,202683560,1,943059469,SAINT ALPHONSUS MEDICAL CENTER ONTARIO VOLUNTEERS
4167,202683560,1,271790052,SAINT ALPHONSUS MEDICAL CENTER-BAKER CITY INC
4168,202683560,0,261737256,SAINT ALPHONSUS MEDICAL CENTER-NAMPA HEALTH FOUNDATION INC
4169,202683560,0,820200896,SAINT ALPHONSUS MEDICAL CENTER-NAMPA INC
4170,202683560,1,271789847,SAINT ALPHONSUS MEDICAL CENTER-ONTARIO INC
4171,202683560,0,820200895,SAINT ALPHONSUS REGIONAL MEDICAL CENTER
4172,202683560,0,451994612,SAINT FRANCIS EMERGENCY MEDICAL GROUP INC
4173,202683560,0,60646813,SAINT FRANCIS HOSPITAL AND MEDICAL CENTER
4174,202683560,0,61008255,SAINT FRANCIS HOSPITAL AND MEDICAL CENTER FOUNDATION INC
4175,202683560,0,262616230,SAINT JAMES CARE INC
4176,202683560,0,473129127,SAINT JOSEPH PACE INC
4177,202683560,0,351142669,SAINT JOSEPH REGIONAL MEDICAL CENTER - PLYMOUTH CAMPUS INC
4178,202683560,0,350868157,SAINT JOSEPH REGIONAL MEDICAL CENTER - SOUTH BEND CAMPUS INC
4179,202683560,0,356043563,SAINT JOSEPH REGIONAL MEDICAL CENTER PLYMOUTH AUXILIARY INC
4180,202683560,0,351568821,SAINT JOSEPH REGIONAL MEDICAL CENTER INC
4181,202683560,0,581744848,SAINT JOSEPH'S HEALTH SYSTEM INC
4182,202683560,0,581752700,SAINT JOSEPH'S MERCY CARE SERVICES INC
4183,202683560,0,311040468,SAINT JOSEPH'S TOWER INC
4184,202683560,0,383320700,SAINT MARY'S AMICARE HOME HEALTHCARE
4185,202683560,0,381779602,SAINT MARY'S FOUNDATION
4186,202683560,0,222528400,SAINT MARY'S HOSPITAL FOUNDATION INC
4187,202683560,0,60646844,SAINT MARY'S HOSPITAL INC
4188,202683560,0,262616046,SAINT MICHAEL'S MEDICAL CENTER INC
4189,202683560,0,141710225,SAMARITAN CHILD CARE CENTER INC
4190,202683560,0,141338544,SAMARITAN HOSPITAL
4191,202683560,0,141708754,SENIOR CARE CONNECTION INC
4192,202683560,0,141505031,SETON AUXILIARY INC
4193,202683560,0,141756230,SETON HEALTH AT SCHUYLER RIDGE RESIDENTIAL HEALTHCARE
4194,202683560,0,222345416,SETON HEALTH FOUNDATION INC
4195,202683560,0,141776186,SETON HEALTH SYSTEM INC
4196,202683560,0,222541103,SISTERS OF PROVIDENCE CARE CENTERS INC
4197,202683560,0,472299757,SJHSJOC HOLDINGS INC
4198,202683560,0,232840137,ST AGNES CONTINUING CARE CENTER
4199,202683560,0,232415137,ST AGNES CONTINUING CARE CENTER FOUNDATION
4200,202683560,0,510374158,ST FRANCIS FOUNDATION
4201,202683560,0,510064326,ST FRANCIS HOSPITAL INC
4202,202683560,0,521025476,ST FRANCIS MEDICAL CENTER FOUNDATION INC
4203,202683560,0,223431049,ST FRANCIS MEDICAL CENTER TRENTON NJ
4204,202683560,0,223127184,ST JAMES MERCY HEALTH SYSTEM INC
4205,202683560,0,560694200,ST JOSEPH OF THE PINES INC
4206,202683560,0,202497520,ST JOSEPH'S COLLEGE OF NURSING AT ST JOSEPH'S HOSPITAL HEALTH CENTER
4207,202683560,0,237219294,ST JOSEPH'S HEALTH CENTER PROPERTIES INC
4208,202683560,0,474754987,ST JOSEPH'S HEALTH INC
4209,202683560,0,150532254,ST JOSEPH'S HOSPITAL HEALTH CENTER
4210,202683560,0,222149775,ST JOSEPH'S HOSPITAL HEALTH CENTER FOUNDATION INC
4211,202683560,0,273899821,ST JOSEPH'S MEDICAL PC
4212,202683560,0,161516863,ST JOSEPH'S PHYSICIAN HEALTH PC
4213,202683560,0,461827502,ST MARY BUILDING AND DEVELOPMENT
4214,202683560,0,465354512,ST MARY EMERGENCY MEDICAL SERVICES
4215,202683560,0,60646843,ST MARY HOME INCORPORATED
4216,202683560,0,231913910,ST MARY MEDICAL CENTER
4217,202683560,0,232567468,ST MARY MEDICAL CENTER FOUNDATION INC
4218,202683560,0,582544232,ST MARY'S FOUNDATION INC
4219,202683560,0,811660088,ST MARY'S GOOD SAMARITAN FOUNDATION INC
4220,202683560,0,580566223,ST MARY'S HEALTH CARE SYSTEM INC
4221,202683560,0,20576648,ST MARY'S HIGHLAND HILLS INC
4222,202683560,0,261858563,ST MARY'S MEDICAL GROUP INC
4223,202683560,0,473752176,ST MARY'S SACRED HEART HOSPITAL INC
4224,202683560,0,453570715,ST PETER'S HEALTH PARTNERS
4225,202683560,0,461177336,ST PETER'S HEALTH PARTNERS MEDICAL ASSOCIATES PC
4226,202683560,0,141348692,ST PETER'S HOSPITAL
4227,202683560,0,222262982,ST PETER'S HOSPITAL FOUNDATION INC
4228,202683560,0,141338386,SUNNYVIEW HOSPITAL AND REHABILITATION CENTER
4229,202683560,0,222505127,SUNNYVIEW HOSPITAL AND REHABILITATION CENTER FOUNDATION INC
4230,202683560,0,222692940,THE COMMUNITY HOSPICE FOUNDATION INC
4231,202683560,0,141608921,THE COMMUNITY HOSPICE INC
4232,202683560,0,351654543,THE FOUNDATION OF SAINT JOSEPH REGIONAL MEDICAL CENTER INC
4233,202683560,0,222570478,THE JAMES A EDDY MEMORIAL GERIATRIC CENTER INC
4234,202683560,0,141793885,THE MARJORIE DOYLE ROCKWELL CENTER INC
4235,202683560,0,43398280,THE MERCY HOSPITAL INC
4236,202683560,0,222743478,THE NORTHEAST HEALTH FOUNDATION INC
4237,202683560,0,60660403,THE WOMEN'S AUXILIARY OF SAINT FRANCIS HOSPITAL AND MEDICAL CENTER INC
4238,202683560,0,383320699,THHS OAKLAND FKA CRANBROOK HOSPICE CARE
4239,202683560,0,382485700,TRI-HOSPITAL EMERGENCY MEDICAL SERVICES
4240,202683560,0,382559656,TRINITY CONTINUING CARE SERVICES
4241,202683560,0,930907047,TRINITY CONTINUING CARE SERVICES - INDIANA
4242,202683560,0,824005577,TRINITY CONTINUING CARE SERVICES - MASSACHUSETTS
4243,202683560,0,382113393,TRINITY HEALTH - MICHIGAN
4244,202683560,0,351443425,TRINITY HEALTH CORPORATION
4245,202683560,0,475244984,TRINITY HEALTH LIFE PENNSYLVANIA INC
4246,202683560,0,61491191,TRINITY HEALTH OF NEW ENGLAND CORPORATION INC
4247,202683560,0,61450168,TRINITY HEALTH OF NEW ENGLAND PROVIDER NETWORK ORGANIZATION INC
4248,202683560,0,473073124,TRINITY HEALTH PACE
4249,202683560,0,208151733,TRINITY HEALTH WELFARE BENEFIT TRUST
4250,202683560,0,382621935,TRINITY HOME HEALTH SERVICES
4251,202683560,0,150532190,UIHLEIN MERCY CENTER
4252,202683560,0,141438749,VILLA MARY IMMACULATE
4253,202683560,0,383280200,WESTSHORE HEALTH NETWORK
4254,943212537,1,930942933,RVM Ashland Housing Corporation
4255,943212537,1,943163349,RVM Bend Housing Corporation
4256,943212537,1,943260016,RVM Bend II Housing Corporation
4257,943212537,1,300315618,RVM Central Point Housing Corporation
4258,943212537,1,311662208,RVM Davis Housing Corporation
4259,943212537,1,943191447,RVM Eagle Point Housing Corporation
4260,943212537,1,943247154,RVM Eugene Housing Corporation
4261,943212537,1,311520436,RVM Fort Worth Housing Corporation
4262,943212537,1,311587415,RVM Fort Worth II Housing Corporation
4263,943212537,1,943136037,RVM Grants Pass Housing Corporation
4264,943212537,1,311662259,RVM Grants Pass II Housing Corporation
4265,943212537,1,930864466,RVM Housing Corporation
4266,943212537,1,943196455,RVM Klamath Falls Housing Corporation
4267,943212537,1,943194409,RVM Lively Oaks Housing Corporation
4268,943212537,1,900292647,RVM Mansfield Housing Corporation
4269,943212537,1,311587418,RVM Medford III Housing Corporation
4270,943212537,1,943162074,RVM Myrtle Creek Housing Corporation
4271,943212537,1,311715321,RVM Myrtle Creek II Housing Corporation
4272,943212537,1,311780332,RVM Portland Housing Corporation
4273,943212537,1,300037898,RVM Portland II Housing Corporation
4274,943212537,1,943212538,RVM Reedsport Housing Corporation
4275,943212537,1,943179782,RVM Roseburg Housing Corporation
4276,943212537,1,311587420,RVM Roseburg II Housing Corporation
4277,943212537,1,943212540,RVM Yreka Housing Corporation
4278,943212537,1,930892261,Community Volunteer Network
4279,943212537,0,391412320,Capitol Lakes Inc
4280,943212537,0,383781089,Capitol Lakes Foundation
4281,943212537,1,930557803,Cascade Manor Inc
4282,943212537,1,931330100,Cascade Manor Foundation
4283,943212537,1,930513697,Holladay Park Plaza
4284,943212537,1,264529118,Holladay Park Plaza Foundation
4285,943212537,0,342030255,Mirabella
4286,943212537,1,452508860,Mirabella Portland Foundation
4287,943212537,1,711016384,Mirabella at South Waterfront
4288,943212537,0,450574348,Mirabella Washington Foundation
4289,943212537,1,931067253,Pacific Retirement Services
4290,943212537,1,472352652,Pacific Retirement Services Foundation
4291,943212537,1,930453216,Rogue Valley Manor
4292,943212537,1,930712867,Rogue Valley Manor Foundation
4293,943212537,0,750891470,The Cumberland Rest Inc
4294,943212537,0,912162130,Trinity Terrace Foundation Inc
4295,943212537,0,931179254,University Retirement Community at Davis
4296,943212537,0,931301816,Univ Rtrmnt Comm at Davis Foundation
4297,943212537,0,813784956,MIRABELLA AT ASU INC
4298,943212537,0,943008774,Bay Area Senior Services Inc
4299,943212540,1,930942933,RVM Ashland Housing Corporation
4300,943212540,1,943163349,RVM Bend Housing Corporation
4301,943212540,1,943260016,RVM Bend II Housing Corporation
4302,943212540,1,300315618,RVM Central Point Housing Corporation
4303,943212540,1,311662208,RVM Davis Housing Corporation
4304,943212540,1,943191447,RVM Eagle Point Housing Corporation
4305,943212540,1,943247154,RVM Eugene Housing Corporation
4306,943212540,1,311520436,RVM Fort Worth Housing Corporation
4307,943212540,1,311587415,RVM Fort Worth II Housing Corporation
4308,943212540,1,943136037,RVM Grants Pass Housing Corporation
4309,943212540,1,311662259,RVM Grants Pass II Housing Corporation
4310,943212540,1,930864466,RVM Housing Corporation
4311,943212540,1,943196455,RVM Klamath Falls Housing Corporation
4312,943212540,1,943194409,RVM Lively Oaks Housing Corporation
4313,943212540,1,900292647,RVM Mansfield Housing Corporation
4314,943212540,1,943212537,RVM Medford II Housing Corporation
4315,943212540,1,311587418,RVM Medford III Housing Corporation
4316,943212540,1,943162074,RVM Myrtle Creek Housing Corporation
4317,943212540,1,311715321,RVM Myrtle Creek II Housing Corporation
4318,943212540,1,311780332,RVM Portland Housing Corporation
4319,943212540,1,300037898,RVM Portland II Housing Corporation
4320,943212540,1,943212538,RVM Reedsport Housing Corporation
4321,943212540,1,943179782,RVM Roseburg Housing Corporation
4322,943212540,1,311587420,RVM Roseburg II Housing Corporation
4323,943212540,1,930892261,Community Volunteer Network
4324,943212540,0,391412320,Capitol Lakes Inc
4325,943212540,0,383781089,Capitol Lakes Foundation
4326,943212540,1,930557803,Cascade Manor Inc
4327,943212540,1,931330100,Cascade Manor Foundation
4328,943212540,1,930513697,Holladay Park Plaza
4329,943212540,1,264529118,Holladay Park Plaza Foundation
4330,943212540,0,342030255,Mirabella
4331,943212540,1,452508860,Mirabella Portland Foundation
4332,943212540,1,711016384,Mirabella at South Waterfront
4333,943212540,0,450574348,Mirabella Washington Foundation
4334,943212540,1,931067253,Pacific Retirement Services
4335,943212540,1,472352652,Pacific Retirement Services Foundation
4336,943212540,1,930453216,Rogue Valley Manor
4337,943212540,1,930712867,Rogue Valley Manor Foundation
4338,943212540,0,750891470,The Cumberland Rest Inc
4339,943212540,0,912162130,Trinity Terrace Foundation Inc
4340,943212540,0,931179254,University Retirement Community at Davis
4341,943212540,0,931301816,Univ Rtrmnt Comm at Davis Foundation
4342,943212540,0,813784956,MIRABELLA AT ASU INC
4343,943212540,0,943008774,Bay Area Senior Services Inc
4344,943196455,1,930942933,RVM Ashland Housing Corporation
4345,943196455,1,943163349,RVM Bend Housing Corporation
4346,943196455,1,943260016,RVM Bend II Housing Corporation
4347,943196455,1,300315618,RVM Central Point Housing Corporation
4348,943196455,1,311662208,RVM Davis Housing Corporation
4349,943196455,1,943191447,RVM Eagle Point Housing Corporation
4350,943196455,1,943247154,RVM Eugene Housing Corporation
4351,943196455,1,311520436,RVM Fort Worth Housing Corporation
4352,943196455,1,311587415,RVM Fort Worth II Housing Corporation
4353,943196455,1,943136037,RVM Grants Pass Housing Corporation
4354,943196455,1,311662259,RVM Grants Pass II Housing Corporation
4355,943196455,1,930864466,RVM Housing Corporation
4356,943196455,1,943194409,RVM Lively Oaks Housing Corporation
4357,943196455,1,900292647,RVM Mansfield Housing Corporation
4358,943196455,1,943212537,RVM Medford II Housing Corporation
4359,943196455,1,311587418,RVM Medford III Housing Corporation
4360,943196455,1,943162074,RVM Myrtle Creek Housing Corporation
4361,943196455,1,311715321,RVM Myrtle Creek II Housing Corporation
4362,943196455,1,311780332,RVM Portland Housing Corporation
4363,943196455,1,300037898,RVM Portland II Housing Corporation
